refid,author,title,accession_num,database_provider,date,id,issue,journal,language,database_name,pages,publication,publisher,volume,year,user,level,snps,o_snps,b_snps,a_snps,a1_snps,a2_snps,snp_num,haplotype,sero,ld,ld_score,sig_result,cohort_total,pop_descrip,afr,amr,eas,eur,sas,other,pheno,study,seq,multi_b_snps,o2,subtypes,o_v_nono,diversity,imputed,notes
1838,"Wang, L.,Chen, M.,Wang, F.,Zhao, X. C.,Song, J. J.,Li, W. S.,Ma, W. H.,Hao, J. P.,Ji, A. Q.,Ye, J.",A 21-plex system of STRs integrated with Y-STR DYS391 and ABO typing for forensic DNA analysis,,,,1112.0,1,Australian Journal of Forensic Sciences,English,Embase,16-26,,,52,2020,Kiana.Martinez,2,Yes,rs8176719,"rs8176746, rs8176747",,,,3,No,Yes,No,,No,90,Chinese Han,0,0,90,0,0,0,ABO blood typing,methods paper,Two Sets of sequence specific primers for chromosome 9 in the ABO gene,"Yes (rs8176747, rs8176746)",No,No,No,No,No,Describing ABO typing so no real stats
1846,"Watanabe, K.,Hosoya, M.,Hirayama, K.,Saitoh, H.,Iwase, H.,Ikegaya, H.,Akutsu, T.,Sekiguchi, K.,Sakurada, K.",Forensic validation of the modified ABO genotyping method using a DNA chip,23477812,Nlm,Jul,1120.0,4,Leg Med (Tokyo),eng,PubMed,222-5,,,15,2013,Kiana.Martinez,2,Yes,rs8176719,"rs8176746, rs8176747",,,,3,No,No,No,,No,10,Japanese,0,0,10,0,0,0,ABO genotyping,methodology paper,genotyping method using a DNA chip,"Yes (rs8176747, rs8176746)",No,No,No,No,,Describing ABO typing so no real stats just like in Ref1838
1848,"Wei, C. Y.,Yang, J. H.,Yeh, E. C.,Tsai, M. F.,Kao, H. J.,Lo, C. Z.,Chang, L. P.,Lin, W. J.,Hsieh, F. J.,Belsare, S.,Bhaskar, A.,Su, M. W.,Lee, T. C.,Lin, Y. L.,Liu, F. T.,Shen, C. Y.,Li, L. H.,Chen, C. H.,Wall, J. D.,Wu, J. Y.,Kwok, P. Y.","Genetic profiles of 103,106 individuals in the Taiwan Biobank provide insights into the health and history of Han Chinese",,,,1122.0,1,npj Genomic Medicine,English,Embase,,,,6,2021,Kiana.Martinez,2,Yes,rs8176719,"rs8176746, rs8176747",,,,3,Yes,No,No,,Yes,103106,East Asian,0,0,103106,0,0,0,genetic profiles for Taiwan Biobank,cohort study,custom SNP array,"Yes (rs8176747, rs8176746)",No,No,No,No,,
1850,"Wei, Y. L.,Li, C. X.,Jia, J.,Hu, L.,Liu, Y.",Forensic identification using a multiplex assay of 47 SNPs,22537537,Nlm,Nov,1124.0,6,J Forensic Sci,eng,PubMed,1448-56,,,57,2012,Kiana.Martinez,2,Yes,rs8176719,rs8176747,,,rs1053878,4,No,No,No,,No,233,Han Chinese,0,0,233,0,0,0,DNA profiling and ABO genotyping,methodology study,Genomelab SNPstream genotyping,No,Yes (rs8176720),No,No,No,,Inferred how the 4 SNPs were used based off of past literature
1874,"Wiggins, K. L.,Smith, N. L.,Glazer, N. L.,Rosendaal, F. R.,Heckbert, S. R.,Psaty, B. M.,Rice, K. M.,Lumley, T.",ABO genotype and risk of thrombotic events and hemorrhagic stroke,19036074,Nlm,Feb,1148.0,2,J Thromb Haemost,eng,PubMed,263-9,,,7,2009,Kiana.Martinez,2,Yes,unclear,unclear,unclear,unclear,unclear,5+,Yes,No,No,,Yes,7761,mostly Caucasian,0,0,0,7161,0,600,thrombotic events and hemorrhagic stroke,case-control study; association study,GoldenGate custom panel using BeadArray technology,Unclear,Yes (unclear),"Yes (O11, O12, A11)",Yes,Yes,,Doesn't clearly state how the 7 SNPs were used to distinguish the blood genotypes
1948,"Zabaneh, D.,Gaunt, T. R.,Kumari, M.,Drenos, F.,Shah, S.,Berry, D.,Power, C.,Hypponen, E.,Shah, T.,Palmen, J.,Pallas, J.,Talmud, P. J.,Casas, J. P.,Sofat, R.,Lowe, G.,Rumley, A.,Morris, R. W.,Whincup, P. H.,Rodriguez, S.,Ebrahim, S.,Marmot, M. G.,Smith, G. D.,Lawlor, D. A.,Kivimaki, M.,Whittaker, J.,Hingorani, A. D.,Day, I. N.,Humphries, S. E.",Genetic variants associated with Von Willebrand factor levels in healthy men and women identified using the HumanCVD BeadChip,21534939,Nlm,Jul,1222.0,4,Ann Hum Genet,eng,PubMed,456-67,,,75,2011,Kiana.Martinez,2,Yes,rs657152,rs8176722,,,rs8176704,1,Yes,Yes,Yes,r2=0.98_rs8176719_rs657152; r2=0.818_rs8176746_rs8176722,Yes,8504,two British cohorts,unclear,unclear,unclear,unclear,unclear,unclear,von Willebrand Factor Levels,association study,Illumina The HumanCVD BeadChip,No,No,No,Yes,Unclear,,Ancestral break-down of the cohorts unclear
1950,"Zakai, N. A.,Judd, S. E.,Alexander, K.,McClure, L. A.,Kissela, B. M.,Howard, G.,Cushman, M.",ABO blood type and stroke risk: the REasons for Geographic And Racial Differences in Stroke Study,24444093,Nlm,Apr,1224.0,4,J Thromb Haemost,eng,PubMed,564-70,,,12,2014,Kiana.Martinez,2,Yes,rs687289,rs8176749,,,rs8176704,4,Yes,No,No,,Yes,1104,black & white,552,0,0,552,0,0,stroke,cohort study,probes from TaqMan,No,No,No,No,Yes,No,Unclear how the 4th SNP (rs507666) is used
7,"Alexander, Kristine S; Zakai, Neil A; Gillett, Sarah; McClure, Leslie A; Wadley, Virginia; Unverzagt, Fred; Cushman, Mary; ","ABO blood type, factor VIII, and incident cognitive impairment in the REGARDS cohort",,,,,,,,,1271-1276,Neurology,AAN Enterprises,83.0,2014,Kiana.Martinez,3,Yes,unclear,unclear,unclear,unclear,unclear,4,Yes,No,No,,No,1082,black and white adults,419,0,0,663,0,0,incident cognitive impairment & factor VIII,prospective cohort study; case-control study; association study,TaqMan probes,Unclear,No,No,No,Yes,,"Unclear how SNPs were used; referenced a publication that didn't have any information either. SNPs used: rs507666, rs687289, rs8176704, rs8176749"
10,"Nakao, Makoto; Matsuo, Keitaro; Hosono, Satoyo; Ogata, Saeko; Ito, Hidemi; Watanabe, Miki; Mizuno, Nobumasa; Iida, Shinsuke; Sato, Shigeki; Yatabe, Yasushi; ",ABO blood group alleles and the risk of pancreatic cancer in a Japanese population,,,,,,,,,1076-1080,Cancer science,Wiley Online Library,102.0,2011,Kiana.Martinez,3,Yes,rs8176719,"rs8176746, rs8176747",,,,3,No,No,No,,No,1650,Japanese,0,0,1650,0,0,0,risk of pancreatic cancer,case-control study; association study,TaqMan real-time PCR assay system,"Yes (rs8176747, rs8176746)",No,No,Yes,No,,
11,"Ohira, T; Cushman, M; Tsai, MY; Zhang, Y; Heckbert, SR; Zakai, NA; Rosamond, WD; Folsom, Aaron R; ","ABO blood group, other risk factors and incidence of venous thromboembolism: the Longitudinal Investigation of Thromboembolism Etiology (LITE)",,,,,,,,,1455-1461,Journal of thrombosis and haemostasis,Wiley Online Library,5.0,2007,Kiana.Martinez,3,Yes,rs8176719,unclear,,,,4,No,No,No,,Yes,1500,"White, African American",401,0,0,1099,0,0,venous thromboembolism,case-control study; association study,MassARRAY homogenous MassEXTEND assay of the Sequenom system,Unclear,Unclear,Yes; O3 (rs7853989),Yes,Yes,,"Unclear exactly how the SNPs were used for defning ABO phenotypes; nothing cited, no supplementary files, etc. (4 SNPs: rs8176719, rs8176720, rs8176743, rs7853989)"
25,"Greer, Julia B; LaRusch, Jessica; Brand, Randall E; O'Connell, Michael R; Yadav, Dhiraj; Whitcomb, David C; ",ABO blood group and chronic pancreatitis risk in the NAPS2 cohort,,,,,,,,,1188,Pancreas,NIH Public Access,40.0,2011,Kiana.Martinez,3,Yes,rs505922,rs8176746,,,,2,No,No,No,,Yes,1127,"White, African American, Other",83,0,0,983,0,61,chronic pancreatitis risk,case-control study,Sequenom custom Mass ARRAY iPLEX Gold assay,No,No,No,Yes,Yes,,
40,"Alkebsi, Lobna; Ideno, Yuki; Lee, Jung-Su; Suzuki, Shosuke; Nakajima-Shimada, Junko; Ohnishi, Hiroshi; Sato, Yasunori; Hayashi, Kunihiko; ",Gastroduodenal ulcers and ABO blood group: the Japan nursesâ€™ health study (JNHS),,,,,,,,,34-40,Journal of epidemiology,Japan Epidemiological Association,28.0,2018,Kiana.Martinez,3,Yes,"rs8176719, rs505922",rs8176746,,,,3,No,Yes,No,,Yes,unclear,Japanese,0,0,unclear,0,0,0,gastroduodenal ulcers,ambispective analysis; cohort study,SNP PCR DNA sequencing,No,No,No,Yes,No,,"They genotyped for a small subset but didn't given the number; didn't report their sequencing platform beyond saying ""examined SNPs…using DNA sequencing"""
48,"Wolpin, Brian M; Kraft, Peter; Gross, Myron; Helzlsouer, Kathy; Bueno-de-Mesquita, H Bas; Steplowski, Emily; Stolzenberg-Solomon, Rachael Z; Arslan, Alan A; Jacobs, Eric J; LaCroix, Andrea; ",Genotype-Derived ABO Blood Group Alleles and the Risk of Pancreatic Cancer: Data from the Pancreatic Cancer Cohort Consortium,,,,,,,,,1015,Cancer research,NIH Public Access,70.0,2010,Kiana.Martinez,3,Yes,rs505922,rs8176746,,,,2,Yes,No,No,,No,3073,"White, Non-white",0,0,0,2841,0,232,pancreatic cancer,association study; case-control study,Genotyping via PanScan,No,No,No,Yes,Yes,,
60,"Manco, LicÃ­nio; Silva, Catarina; Fidalgo, Teresa; Martinho, PatrÃ­cia; Sarmento, Ana B; Ribeiro, M LetÃ­cia; ","Venous thromboembolism risk associated with ABO, F11 and FGG loci",,,,,,,,,528-532,Blood Coagulation & Fibrinolysis,LWW,29.0,2018,Kiana.Martinez,3,Yes,rs8176719,,,,,1,No,No,No,,Yes,244,European descent,0,0,0,244,0,0,venous thromboembolism,caseâ€“control study; association study,PCRâ€“restriction fragment length polymorphism with primers,No,No,No,Yes,No,,Only looked at O vs non-O
65,"Nakao, Makoto; Matsuo, Keitaro; Ito, Hidemi; Shitara, Kohei; Hosono, Satoyo; Watanabe, Miki; Ito, Seiji; Sawaki, Akira; Iida, Shinsuke; Sato, Shigeki; ","ABO Genotype and the Risk of Gastric Cancer, Atrophic Gastritis, and Helicobacter pylori InfectionABO Genotype on the Risk of Gastric Cancer",,,,,,,,,1665-1672,"Cancer epidemiology, biomarkers & prevention",AACR,20.0,2011,Kiana.Martinez,3,Yes,rs8176719,"rs8176746, rs8176747",,,,3,No,No,No,,Yes,2168,Japanese,0,0,2168,0,0,0,"gastric cancer, atrophic gastritis,","caseâ€“control study; association study, Helicobacter pylori infection",TaqMan real-time PCR assay,"Yes (rs8176747, rs8176746)",No,No,No,No,,
89,"Wang, Jingzhou; Jamnik, Joseph; GarcÃ­a-Bailo, Bibiana; Nielsen, Daiva E; Jenkins, David JA; El-Sohemy, Ahmed; ",ABO genotype does not modify the association between the â€œblood-typeâ€ diet and biomarkers of cardiometabolic disease in overweight adults,,,,,,,,,518-525,The Journal of nutrition,Oxford University Press,148.0,2018,Kiana.Martinez,3,Yes,rs8176719,rs8176746,,,,2,No,No,No,,Yes,973,from Toronto,unclear,unclear,unclear,unclear,unclear,unclear,biomarkers of cardiometabolic disease in overweight adults,cohort study,Sequenomâ€™s MassARRAY multiplex,No,No,No,No,Unclear,,
98,"Li, Donghui; Pise, Mayurika N; Overman, Michael J; Liu, Chang; Tang, Hongwei; Vadhanâ€Raj, Saroj; Abbruzzese, James L; ",ABO nonâ€O type as a risk factor for thrombosis in patients with pancreatic cancer,,,,,,,,,1651-1658,Cancer medicine,Wiley Online Library,4.0,2015,Kiana.Martinez,3,Yes,rs505922,rs8176746,,,,2,No,No,No,,Yes,375,"non-Hispanic whites, other",0,0,0,unclear,0,unclear,venous thromboembolism,case-control study; association study,Taqman assay,No,No,No,Yes,Yes,,"56% of cohort was genotyped for ABO; 887.% of total cohort was described as ""non-Hispanic white"""
102,"Shelton, Janie F; Shastri, Anjali J; Ye, Chelsea; Weldon, Catherine H; Filshtein-Sonmez, Teresa; Coker, Daniella; Symons, Antony; Esparza-Gordillo, Jorge; Aslibekyan, Stella; Auton, Adam; ",Trans-ancestry analysis reveals genetic and nongenetic associations with COVID-19 susceptibility and severity,,,,,,,,,801-808,Nature Genetics,Nature Publishing Group,53.0,2021,Kiana.Martinez,3,Yes,rs8176719,rs8176747,,,,3,Yes,No,No,,Yes,1051032,"European, Latino, African American, Other",28592,118787,0,843567,0,60086,COVID-19,cohort study; case-control study; GWAS,"Illumina HumanHap550 BeadChip,  Illumina OmniExpress BeadChip. Illumina custom array,   Illumina Global Screening Array",No,Yes (rs41302905),No,Yes,Yes,,
139,"Masuda, Masatoshi; Okuda, Kayo; Ikeda, Daisuke D; Hishigaki, Haretsugu; Fujiwara, Tsutomu; ",Interaction of genetic markers associated with serum alkaline phosphatase levels in the Japanese population,,,,,,,,,6-Jan,Human genome variation,Nature Publishing Group,2.0,2015,Kiana.Martinez,3,Yes,rs72238104,rs8176746,,,,2,Yes,No,No,,No,2944,Japanese,0,0,2944,0,0,0,serum alkaline phosphatases levels,GWAS,Illumina HumanOmni 2.5â€“8 platform,No,No,No,No,No,Yes (rs72238104),60% genotypes from UKB Axiom SNP array and 40% whole-exome sequencing
252,"Shi, Zhuqing; Resurreccion, W Kyle; Wang, Chi-Hsiung; Wei, Jun; Na, Rong; Zheng, S Lilly; Billings, Liana K; Helfand, Brian T; Khandekar, Janardan; Xu, Jianfeng; ",Association of Cancer with Risk and Mortality of COVID-19: Results from the UK Biobank,,,,,,,,,,medRxiv,Cold Spring Harbor Laboratory Press,,2020,Kiana.Martinez,3,Yes,rs8176719,rs8176746,,,,2,Unclear,No,No,,No,500822,black and white,8017,0,0,471180,0,21625,44 different types of cancers & COVID-19,association study,"UKB Axiom SNP array data, whole-exome sequencing",No,No,No,No,Yes,unclear,
264,"Jaworek, Thomas; Xu, Huichun; Gaynor, Brady J; Cole, John W; RannikmÃ¤e, Kristiina; Stanne, Tara M; Tomppo, Liisa; Abedi, Vida; Amouyel, Philippe; Armstrong, Nicole D; ",Genetic Contributions to Early and Late Onset Ischemic Stroke,,,,,,,,,,medRxiv,Cold Spring Harbor Laboratory Press,,2021,Kiana.Martinez,3,Yes,rs8176719,"rs8176746, rs8176743",,rs2519093,rs1053878,5+,Yes,Yes,No,,Yes,16927,"European, Hispanic, Afro-Caribbean, pan-Asian",1303,189,0,10549,0,4204,ischemic stroke,meta-analysis of GWAS,PCR/ Specific SNP,"Yes (rs8176746, rs8176743)",Yes (rs41302905),No,No,Yes,unclear,"6 SNPs used; bucketing ""Afro-Caribbean ancestry"" as African ancestry according to 1000G; ""pan-Asian"" under other; Unclear which SNPs were imputed but imputed with TOPMed; supplementary not available"
277,"Desch, Karl C; Ozel, Ayse B; Halvorsen, Matt; Jacobi, Paula M; Golden, Krista; Underwood, Mary; Germain, Marine; Tregouet, David-Alexandre; Reitsma, Pieter H; Kearon, Clive; ",Whole-exome sequencing identifies rare variants in STAB2 associated with venous thromboembolic disease,,,,,,,,,533-541,Blood,American Society of Hematology,136.0,2020,Kiana.Martinez,3,Yes,unclear,unclear,unclear,unclear,unclear,,Unclear,No,No,,No,1162,TwinsUK study,unclear,unclear,unclear,unclear,unclear,unclear,venous thromboembolic disease,whole-exome study; case-control study; association study,"exome seqeuncing, Illumina TruSeq",Unclear,Unclear,No,No,Unclear,unclear,ABO typing only from subset of TwinsUK study that had STAB info; no information on how they derived abo bloodtypes
279,"Goldbergova, Monika Pavkova; Spinarova, Lenka; Spinar, Jindrich; VÃ­tovec, Jiri; Parenica, Jiri; Poloczek, Martin; Vasku, Anna; ",RXRA introne polymorphism and ABO blood groups in chronic heart failure,,,,,,,,,749-756,Open Life Sciences,De Gruyter Open Access,5.0,2010,Kiana.Martinez,3,Yes,unclear,unclear,,,,4,No,No,No,,Yes,484,Czech population,0,0,0,484,0,0,chronic heart failure,case-control study,PCR and RFLP methods,Unclear,No,No,No,No,No,Referenced a book Herrin 1996 for abo typing with PCR but unsure what snps were used 
283,"Pedersen, Katrina S; Bamlet, William R; Oberg, Ann L; De Andrade, Mariza; Matsumoto, Martha E; Tang, Hui; Thibodeau, Stephen N; Petersen, Gloria M; Wang, Liang; ",Leukocyte DNA methylation signature differentiates pancreatic cancer patients from healthy controls,,,,,,,,,e18223,PloS one,"Public Library of Science San Francisco, USA",6.0,2011,Kiana.Martinez,3,Yes,unclear,unclear,unclear,unclear,unclear,,Unclear,No,No,,No,1073,unclear,unclear,unclear,unclear,unclear,unclear,unclear,pancreatic adenocarcinoma,case-control; epigenetic study,GWAS genotype information,Unclear,No,No,Yes,Unclear,unclear,Stated they derived ABO from genotypes but no further information given
304,"Huang, Jiaqi; Zagai, Ulrika; Hallmans, GÃ¶ran; NyrÃ©n, Olof; Engstrand, Lars; Stolzenbergâ€Solomon, Rachael; Duell, Eric J; Overvad, Kim; Katzke, Verena A; Kaaks, Rudolf; ","Helicobacter pylori infection, chronic corpus atrophic gastritis and pancreatic cancer risk in the European Prospective Investigation into Cancer and Nutrition (EPIC) cohort: A nested caseâ€control study",,,,,,,,,1727-1735,International journal of cancer,Wiley Online Library,140.0,2017,Kiana.Martinez,3,Yes,rs505922,rs8176746,,,,2,Unclear,No,No,,No,896,European,0,0,0,896,0,0,"Helicobacter pylori infection, chronic corpus atrophic gastritis, pancreatic cancer",case-control study; association study,genotyping 2 known SNPs,No,No,No,Yes,No,unclear,
355,"Sakaue, Saori; Kanai, Masahiro; Tanigawa, Yosuke; Karjalainen, Juha; Kurki, Mitja; Koshiba, Seizo; Narita, Akira; Konuma, Takahiro; Yamamoto, Kenichi; Akiyama, Masato; ",A cross-population atlas of genetic associations for 220 human phenotypes,,,,,,,,,1415-1424,Nature genetics,Nature Publishing Group,53.0,2021,Kiana.Martinez,3,Yes,rs8176719,"rs8176746, rs8176747",,,,3,Yes,No,No,,Yes,unclear,Japanese and UK studies,unclear,unclear,unclear,unclear,unclear,unclear,220 phenotypes,GWAS; meta-analyses,"Illumina HumanOmniExpressExome BeadChip, Illumina HumanOmniExpress and HumanExome BeadChip, Applied Biosystems UK BiLEVE Axiom Array, Applied Biosystems UK Biobank Axiom Array","Yes (rs8176747, rs8176746)",No,No,Yes,Yes,unclear,Genomic data in general was imputed with 1000Genomes Project Phase 3
373,"Ellinghaus, David; Degenhardt, Frauke; Juzenas, Simonas; Lerga-Jaso, Jon; Wendorff, Mareike; Maya-Miles, Douglas; Uellendahl-Werth, Florian; ElAbd, Hesham; Lenning, Ole Bernt; Myhre, Ronny; ",Detailed stratified GWAS analysis for severe COVID-19 in four European populations,,,,,,,,,,,,,2022,Kiana.Martinez,3,Yes,rs8176719,rs8176747,,,,3,Yes,No,No,,No,18933,European,0,0,0,18933,0,0,COVID-19,genome-wide association meta-analysis; case-control study," Illumina’s GSA, followed by genotype QC analysis and TOPMed genotype imputation",No,Yes (rs41302905),No,Yes,No,unclear,Genomic data in geral was imputed with TOPMed
402,"Streicher, Samantha A; Klein, Alison P; Olson, Sara H; Amundadottir, Laufey T; DeWan, Andrew T; Zhao, Hongyu; Risch, Harvey A; ",Impact of Sixteen Established Pancreatic Cancer Susceptibility Loci in American JewsGenetics of Pancreatic Cancer in Jews,,,,,,,,,1540-1548,"Cancer Epidemiology, Biomarkers & Prevention",AACR,26.0,2017,Kiana.Martinez,3,Yes,rs505922,rs8176746,,,,2,Yes,No,No,,Yes,58780,European,0,0,0,58780,0,0,pancreatic cancer,case-control study,"Illumina HumanHap550 Infinium array,   Illumina Human610-Quad array,   Illumina HumanOmniExpressExome array, Affymetrix Axiom Genome-wide EUR array",No,No,No,Yes,No,unclear,Genomic data in geral was imputed with IMPUTE
444,"Nemeth, Banne; Adrichem, Raymond A van; Hylckama Vlieg, Astrid van; Bucciarelli, Paolo; Martinelli, Ida; Baglin, Trevor; Rosendaal, Frits R; Cessie, Saskia le; Cannegieter, Suzanne C; ","Venous thrombosis risk after cast immobilization of the lower extremity: derivation and validation of a clinical prediction score, L-TRiP (cast), in three population-based caseâ€“control studies",,,,,,,,,e1001899,PLoS medicine,"Public Library of Science San Francisco, CA USA",12.0,2015,Kiana.Martinez,3,Yes,rs8176719,rs8176749,,,rs8176750,4,No,No,No,,No,10569,from the Netherlands and Italy,0,0,0,10569,0,0,venous thromboembolism,case-control study; association study,TaqMan assay,No,Yes (rs7853989),No,Yes,No,No,Seemed like they only derived abo from genetic data for the MEGA studya and not the validations study
559,"Fehren-Schmitz, Lars; Llamas, Bastien; Lindauer, Susanne; Tomasto-Cagigao, Elsa; Kuzminsky, Susan; Rohland, Nadin; Santos, FabrÃ­cio R; Kaulicke, Peter; Valverde, Guido; Richards, Stephen M; ",A re-appraisal of the early Andean human remains from Lauricocha in Peru,,,,,,,,,e0127141,PloS one,"Public Library of Science San Francisco, CA USA",10.0,2015,Kiana.Martinez,3,Yes,rs8176719,rs8176746,,,,4,No,No,No,,No,4,Central Andean,0,4,0,0,0,0,ancient remains from the Central Andes,qualitative study,multiplex SBE PCR co-amplifying 4 SNPs,No,"Yes (rs8176720, rs41302905)",No,No,No,No,Anthropological paper about an ancient cave cite in the Central Andes
882,"Chung, C. M.,Wang, R. Y.,Chen, J. W.,Fann, C. S. J.,Leu, H. B.,Ho, H. Y.,Ting, C. T.,Lin, T. H.,Sheu, S. H.,Tsai, W. C.,Chen, J. H.,Jong, Y. S.,Lin, S. J.,Chen, Y. T.,Pan, W. H.",A genome-wide association study identifies new loci for ACE activity: Potential implications for response to ACE inhibitor,,,,156.0,6,Pharmacogenomics Journal,English,Embase Medline,537-544,,,10.0,2010,Kiana.Martinez,3,Yes,,rs8176746,rs498528,,,2,Unclear,Yes,No,,Yes,464,Taiwanese,0,0,464,0,0,0,angiotensin-converting enzyme,GWAS,Illumina Infinium II HumanHap550 SNP chips,No,No,No,No,No,No,O bloodtype set as the reference and SNPs for A and B
904,"Coto, E.,Albaiceta, G. M.,Clemente, M. G.,Gomez, J.",Lack of association between SNPsrs8176719 (O blood group) and COVID-19: Data from Spanish age matched patients and controls,33191530,Ovid Technologies,2,178.0,2,Transfusion,English,MEDLINE,654-656,,,61.0,2021,Kiana.Martinez,3,Yes,rs8176719,,,,,1,No,No,No,,No,658,Caucasian,0,0,0,658,0,0,COVID-19,qualitative study; case-control study,PCR followed by restriction enzyme digestion,No,No,No,Yes,No,No,Letter to the editor describing small study
934,"de Visser, M. C. H.,van Minkelen, R.,van Marion, V.,den Heijer, M.,Eikenboom, J.,Vos, H. L.,Slagboom, P. E.,Houwing-Duistermaat, J. J.,Rosendaal, F. R.,Bertina, R. M.",Genome-wide linkage scan in affected sibling pairs identifies novel susceptibility region for venous thromboembolism: Genetics in familial thrombosis study,,,,208.0,8,Journal of Thrombosis and Haemostasis,English,Embase Medline,1474-1484,,,11.0,2013,Kiana.Martinez,3,Yes,rs8176719,,,,,1,No,No,No,,No,1481,Caucasian,0,0,0,1481,0,0,venous thromboembolism,linkage analysis & fine mapping; cohort study; case-control study,TaqMan assay,No,No,No,Yes,No,No,
943,"Dite, G. S.,Murphy, N. M.,Allman, R.",An integrated clinical and genetic model for predicting risk of severe COVID-19: A population-based caseâ€“control study,,,,217.0,2-Feb,PLoS ONE,English,Embase Medline,,,,16.0,2021,Kiana.Martinez,3,Yes,"rs8176719, rs505922",rs8176746,,,,3,Unclear,No,No,,Yes,1582,"white, other",1377,0,0,0,0,205,COVID-19,case-control study; association study,"Applied Biosystems UK BiLEVE Axiom Array by Affymetrix, Applied Biosystems UK Biobank Axiom Array",No,No,No,No,Yes,"Yes (rs505922, rs8176719, rs8176746)",
950,"Du, Y.,Martin, J. S.,McGee, J.,Yang, Y.,Liu, E. Y.,Sun, Y.,Geihs, M.,Kong, X.,Zhou, E. L.,Li, Y.,Huang, J.",A SNP panel and online tool for checking genotype concordance through comparing QR codes,,,,224.0,9,PLoS ONE,English,Embase Medline,,,,12.0,2017,Kiana.Martinez,3,Yes,rs8176719,rs8176746,,,rs56392308,4,No,No,No,,No,150000,UK Biobank,unclear,unclear,unclear,unclear,unclear,unclear,SNP panels,methodology study,"Axiom PMRA, Axiom UK Biobank, Axiom Biobank, Illumina GSA, Omni Express, 23&Me, Genes for Good, Exome Array",No,Yes (rs41302905),No,No,Unclear,unclear,"A methods paper working on making a SNP panel to create a ""genetic fingerprint"""
953,"Duell, E. J.,Bonet, C.,MuÃ±oz, X.,Lujan-Barroso, L.,Weiderpass, E.,Boutron-Ruault, M. C.,Racine, A.,Severi, G.,Canzian, F.,Rizzato, C.,Boeing, H.,Overvad, K.,TjÃ¸nneland, A.,ArgÃ¼elles, M.,SÃ¡nchez-Cantalejo, E.,Chamosa, S.,Huerta, J. M.,Barricarte, A.,Khaw, K. T.,Wareham, N.,Travis, R. C.,Trichopoulou, A.,Trichopoulos, D.,Yiannakouris, N.,Palli, D.,Agnoli, C.,Tumino, R.,Naccarati, A.,Panico, S.,Bueno-de-Mesquita, H. B.,Siersema, P. D.,Peeters, P. H.,Ohlsson, B.,Lindkvist, B.,Johansson, I.,Ye, W.,Johansson, M.,Fenger, C.,Riboli, E.,Sala, N.,GonzÃ¡lez, C. A.",Variation at ABO histo-blood group and FUT loci and diffuse and intestinal gastric cancer risk in a European population,24947433,Nlm,15-Feb,227.0,4,Int J Cancer,eng,PubMed,880-93,,,136.0,2015,Kiana.Martinez,3,Yes,rs505922,rs8176743,,,,2,Yes,No,Yes,r2=1_rs8176746_rs8176743,Yes,1496,European,0,0,0,1496,0,0,gastric cancer,case-control study; association study,customized array using the Illumina Beadstation Platform and GoldenGate technology,No,No,No,Yes,No,No,
973,"El Jellas, K.,Hoem, D.,Hagen, K. G.,Kalvenes, M. B.,Aziz, S.,Steine, S. J.,Immervoll, H.,Johansson, S.,Molven, A.",Associations between ABO blood groups and pancreatic ductal adenocarcinoma: influence on resection status and survival,28556564,Nlm,Jul,247.0,7,Cancer Med,eng,PubMed,1531-1540,,,6.0,2017,Kiana.Martinez,3,Yes,rs505922,rs8176746,,,rs8176704,3,Yes,Yes,No,,Yes,237,Western Norwegian,0,0,0,237,0,0,pancreatic cancer,case-control study; association study,TaqMan predesigned genotyping assays,No,No,No,Yes,No,No,
1022,"Forni, D.,Cleynen, I.,Ferrante, M.,Cassinotti, A.,Cagliani, R.,Ardizzone, S.,Vermeire, S.,Fichera, M.,Lombardini, M.,Maconi, G.,de Franchis, R.,Asselta, R.,Biasin, M.,Clerici, M.,Sironi, M.",ABO histo-blood group might modulate predisposition to Crohn's disease and affect disease behavior,24268527,Nlm,Jun,296.0,6,J Crohns Colitis,eng,PubMed,489-94,,,8.0,2014,Kiana.Martinez,3,Yes,rs687289,rs8176749,,,,2,No,No,No,,Yes,3506,European,0,0,0,3506,0,0,Crohn's disease,caseâ€“control study; associations study,TaqMan SNP genotyping assay,No,No,No,Yes,No,No,
1025,"Fry, A. E.,Griffiths, M. J.,Auburn, S.,Diakite, M.,Forton, J. T.,Green, A.,Richardson, A.,Wilson, J.,Jallow, M.,Sisay-Joof, F.,Pinder, M.,Peshu, N.,Williams, T. N.,Marsh, K.,Molyneux, M. E.,Taylor, T. E.,Rockett, K. A.,Kwiatkowski, D. P.",Common variation in the ABO glycosyltransferase is associated with susceptibility to severe Plasmodium falciparum malaria,18003641,Nlm,15-Feb,299.0,4,Hum Mol Genet,eng,PubMed,567-76,,,17.0,2008,Kiana.Martinez,3,Yes,rs8176719,rs8176746,,,,2,Yes,No,No,,Yes,4058,African,4058,0,0,0,0,0,Plasmodium falciparum malaria,linkage study; association study; case-control study,Sequenom MassArray genotyping platform,No,No,No,Yes,No,No,
