refid,author,title,accession_num,database_provider,date,id,issue,journal,language,database_name,pages,publication,publisher,volume,year,user,level,snps,o_snps,b_snps,a_snps,a1_snps,a2_snps,snp_num,haplotype,sero,ld,ld_score,sig_result,cohort_total,pop_descrip,afr,amr,eas,eur,sas,other,pheno,study,seq,multi_b_snps,o2,subtypes,o_v_nono,diversity,imputed,notes
1608,"Risch, H. A.,Lu, L.,Wang, J.,Zhang, W.,Ni, Q.,Gao, Y. T.,Yu, H.",ABO blood group and risk of pancreatic cancer: a study in Shanghai and meta-analysis,23652164,Nlm,15-Jun,882.0,12,Am J Epidemiol,eng,PubMed,1326-37,,,177.0,2013,Kiana.Martinez,3,Yes,rs8176719,rs8176746,,,,2,No,No,No,,Yes,1605,Han Chinese,0,0,1605,0,0,0,pancreatic cancer,case-control study; association study,TaqMan genotyping assays,No,No,No,Yes,No,No,
1613,"Rizzato, C.,Campa, D.,Pezzilli, R.,Soucek, P.,Greenhalf, W.,Capurso, G.,Talar-Wojnarowska, R.,Heller, A.,Jamroziak, K.,Khaw, K. T.,Key, T. J.,Bambi, F.,Landi, S.,Mohelnikova-Duchonova, B.,Vodickova, L.,BÃ¼chler, M. W.,Bugert, P.,Vodicka, P.,Neoptolemos, J. P.,Werner, J.,Hoheisel, J. D.,Bauer, A. S.,Giese, N.,Canzian, F.",ABO blood groups and pancreatic cancer risk and survival: results from the PANcreatic Disease ReseArch (PANDoRA) consortium,23403949,Nlm,Apr,887.0,4,Oncol Rep,eng,PubMed,1637-44,,,29.0,2013,Kiana.Martinez,3,Yes,rs505922,"rs8176747, rs8176720, rs8176741, rs8176746",,,rs1053878,5+,No,Yes,No,,No,3285,"Czech, German, Italian, Brith, Polish",0,0,0,3285,0,0,pancreatic cancer risk,case-control study; association study,allele-specific PCR-based KASPar SNP genotyping system,"Yes (rs8176747, rs8176720, rs8176741, rs8176746)",No,No,No,No,unclear,
1634,"RÃ¼hlemann, M. C.,Hermes, B. M.,Bang, C.,Doms, S.,Moitinho-Silva, L.,Thingholm, L. B.,Frost, F.,Degenhardt, F.,Wittig, M.,KÃ¤ssens, J.,Weiss, F. U.,Peters, A.,Neuhaus, K.,VÃ¶lker, U.,VÃ¶lzke, H.,Homuth, G.,Weiss, S.,Grallert, H.,Laudes, M.,Lieb, W.,Haller, D.,Lerch, M. M.,Baines, J. F.,Franke, A.","Genome-wide association study in 8,956 German individuals identifies influence of ABO histo-blood groups on gut microbiome",33462482,Nlm,Feb,908.0,2,Nat Genet,eng,PubMed,147-155,,,53.0,2021,Kiana.Martinez,3,Yes,rs687289,rs8176746,,rs507666,rs8176704,4,Yes,No,No,,Yes,8956,German,0,0,0,8956,0,0,gut microbiome,GWAS,"Affymetrix Genome-Wide Human SNP Array 6.0, Infinium OmniExpressExome array, Affymetrix Axiom array",No,No,No,Yes,No,unclear,Some genomic data imputed
1635,"Rummel, S.,Shriver, C. D.,Ellsworth, R. E.",Relationships between the ABO blood group SNP rs505922 and breast cancer phenotypes: a genotype-phenotype correlation study,22642827,Nlm,29-May,909.0,,BMC Med Genet,eng,PubMed,41,,,13.0,2012,Kiana.Martinez,3,Yes,rs505922,,,,,1,No,No,No,,Yes,629,Caucasian women,0,0,0,629,0,0,breast cancer,qualitative study; a genotype-phenotype correlation study,TaqMan SNP assay,No,No,No,Yes,No,No,
1647,"Sanders, Y. V.,van der Bom, J. G.,Isaacs, A.,Cnossen, M. H.,de Maat, M. P. M.,Laros-van Gorkom, B. A. P.,Fijnvandraat, K.,Meijer, K.,van Duijn, C. M.,Mauser-Bunschoten, E. P.,Eikenboom, J.,Leebeek, F. W. G.,Coppens, M.,Kors, A.,de Meris, J.,Nijziel, M. R.,Meijer, K.,Tamminga, R. Y. J.,Ypma, P. F.,van der Bom, J. G.,Smiers, F. J. W.,Granzen, B.,Hamulyak, K.,Brons, P.,Cnossen, M. H.,Sanders, Y. V.",CLEC4M and STXBP5 gene variations contribute to von Willebrand factor level variation in von Willebrand disease,,,,921.0,6,Journal of Thrombosis and Haemostasis,English,Embase Medline,956-966,,,13.0,2015,Kiana.Martinez,3,Yes,rs687289,rs8176749,,rs507666,rs8176704,4,No,No,No,,No,unclear,from the Netherlands,0,0,0,unclear,0,0,"von Willebrand factor, von Willebrand disease",association study,TaqMan Genotyping Assays,No,No,No,Yes,No,No,
1661,"Schmitz, D.,Ek, W. E.,Berggren, E.,HÃ¶glund, J.,Karlsson, T.,Johansson, ",Genome-wide Association Study of Estradiol Levels and the Causal Effect of Estradiol on Bone Mineral Density,34255042,Nlm,21-Oct,935.0,11,J Clin Endocrinol Metab,eng,PubMed,e4471-e4486,,,106.0,2021,Kiana.Martinez,3,Yes,rs657152,,,,,1,No,No,Yes,r2=0.98_rs8176719_rs657152,Yes,361975,Caucasian,0,0,0,361975,0,0,"estradiol, bone density",GWAS,UKB Axiom array,No,No,No,Yes,No,unclear,
1668,"Scholz, M.,Horn, K.,Pott, J.,Gross, A.,Kleber, M. E.,Delgado, G. E.,Mishra, P. P.,Kirsten, H.,Gieger, C.,MÃ¼ller-Nurasyid, M.,TÃ¶njes, A.,Kovacs, P.,LehtimÃ¤ki, T.,Raitakari, O.,KÃ¤hÃ¶nen, M.,Gylling, H.,Baber, R.,Isermann, B.,Stumvoll, M.,Loeffler, M.,MÃ¤rz, W.,Meitinger, T.,Peters, A.,Thiery, J.,Teupser, D.,Ceglarek, U.",Genome-wide meta-analysis of phytosterols reveals five novel loci and a detrimental effect on coronary atherosclerosis,35013273,Nlm,10-Jan,942.0,1,Nat Commun,eng,PubMed,143,,,13.0,2022,Kiana.Martinez,3,Yes,rs8176719,,,,,1,No,No,No,,Yes,9754,European ancestry,0,0,0,9754,0,0,"phytosterols, coronary artery disease",GWAS; genome-wide meta-analysis,"Illumina Omni 2.5, Illumina Omni Express, Affymetrix Axiom CEU1, Axiom custom array, Affymetrix Genome-Wide Human SNP Array 6.0, Illumina 200k Metabochip, Affymetrix Gene Chip Human Mapping 500 K Array Set, Illumina Human 670 k BeadChips",No,No,No,No,No,unclear,Some genomic data imputed
1705,"Sliz, E.,Kalaoja, M.,Ahola-Olli, A.,Raitakari, O.,Perola, M.,Salomaa, V.,LehtimÃ¤ki, T.,Karhu, T.,ViinamÃ¤ki, H.,Salmi, M.,Santalahti, K.,Jalkanen, S.,Jokelainen, J.,KeinÃ¤nen-Kiukaanniemi, S.,MÃ¤nnikkÃ¶, M.,Herzig, K. H.,JÃ¤rvelin, M. R.,Sebert, S.,Kettunen, J.",Genome-wide association study identifies seven novel loci associating with circulating cytokines and cell adhesion molecules in Finns,31217265,Nlm,Sep,979.0,9,J Med Genet,eng,PubMed,607-616,,,56.0,2019,Kiana.Martinez,3,Yes,unclear,rs8176746,,rs507666,,,Unclear,No,No,,Yes,5284,Finnish,0,0,0,5284,0,0,circulating cytokines and cell adhesion molecules,GWAS,370 k Illumina HumanHap arrays,No,No,No,No,No,unclear,Did an A vs non-A analysis
1706,"SmÃ¥brekke, B.,Rinde, L. B.,Evensen, L. H.,Morelli, V. M.,Hveem, K.,Gabrielsen, M. E.,NjÃ¸lstad, I.,Mathiesen, E. B.,Rosendaal, F. R.,Braekkan, S. K.,Hansen, J. B.",Impact of prothrombotic genotypes on the association between family history of myocardial infarction and venous thromboembolism,31124268,Nlm,Aug,980.0,8,J Thromb Haemost,eng,PubMed,1363-1371,,,17.0,2019,Kiana.Martinez,3,Yes,rs8176719,,,,,1,No,No,No,,No,11566,Norwegian,0,0,0,11566,0,0,myocardial infarction; venous thromboembolism,association study; case-cohort study,Sequenom platform; Illumina HumanCore Exome array,No,No,No,Yes,No,No,
1724,"Spavor, M.,Halton, J.,Dietrich, K.,Israels, S.,Shereck, E.,Yong, J.,Yasui, Y.,Mitchell, L. G.","Age at cancer diagnosis, non-O blood group and asparaginase therapy are independently associated with deep venous thrombosis in pediatric oncology patients: A risk model",,,,998.0,,Thrombosis Research,English,Embase Medline,27-31,,,144.0,2016,Kiana.Martinez,3,Yes,rs505922,rs8176746,,,,2,No,No,No,,Yes,218,recruited in Canada,unclear,unclear,unclear,unclear,unclear,unclear,deep venous thrombosis,case-control study; association study,allele specific primer extension using MagPlex TAG Microspheres,No,No,No,Yes,Unclear,No,
1763,"Tang, W.,Cushman, M.,Green, D.,Rich, S. S.,Lange, L. A.,Yang, Q.,Tracy, R. P.,Tofler, G. H.,Basu, S.,Wilson, J. G.,Keating, B. J.,Weng, L. C.,Taylor, H. A.,Jacobs, D. R.,Delaney, J. A.,Palmer, C. D.,Young, T.,Pankow, J. S.,O'Donnell, C. J.,Smith, N. L.,Reiner, A. P.,Folsom, A. R.",Gene-centric approach identifies new and known loci for FVIII activity and VWF antigen levels in European Americans and African Americans,,,,1037.0,6,American Journal of Hematology,English,Embase Medline,534-540,,,90.0,2015,Kiana.Martinez,3,Yes,"rs529565, rs8176693",rs8176749,,,rs8176704,5,Yes,No,Yes,rs529565 (r2=0.67); rs8176693 (r2=0.55);  rs8176704 (r2=1),No,23603,"Europeans, African Americans",5047,0,0,18556,0,0,coagulation factor VIII and von Willebrand factor,association study,IBC Illumina iSELECT array,No,Yes (rs512770),No,No,Yes,No,"Some genomic data imputed; used rs529565 (r2=0.67)  to tag O in Eur, rs8176693 (r2=0.55) to tag O in AA, rs8176704 (r2=1)  to tag A2 in both Eur and AA; gave ld scores for some tags but didn't specify the functional SNP"
1764,"Tanikawa, C.,Kamatani, Y.,Toyoshima, O.,Sakamoto, H.,Ito, H.,Takahashi, A.,Momozawa, Y.,Hirata, M.,Fuse, N.,Takai-Igarashi, T.,Shimizu, A.,Sasaki, M.,Yamaji, T.,Sawada, N.,Iwasaki, M.,Tsugane, S.,Naito, M.,Hishida, A.,Wakai, K.,Furusyo, N.,Murakami, Y.,Nakamura, Y.,Imoto, I.,Inazawa, J.,Oze, I.,Sato, N.,Tanioka, F.,Sugimura, H.,Hirose, H.,Yoshida, T.,Matsuo, K.,Kubo, M.,Matsuda, K.",Genome-wide association study identifies gastric cancer susceptibility loci at 12q24.11-12 and 20q11.21,30281874,Nlm,Dec,1038.0,12,Cancer Sci,eng,PubMed,4015-4024,,,109.0,2018,Kiana.Martinez,3,Yes,rs505922,rs8176746,,,,2,Unclear,No,Yes,r2=0.97_rs8176719_rs505922,No,50411,Japanese,0,0,50411,0,0,0,gastric cancer,GWAS; case-control study,"Illumina OmniExpressExome, OmniExpress,  HumanExome BeadChip",No,No,No,No,No,unclear,Some genomic data imputed
1766,"Tanikawa, C.,Urabe, Y.,Matsuo, K.,Kubo, M.,Takahashi, A.,Ito, H.,Tajima, K.,Kamatani, N.,Nakamura, Y.,Matsuda, K.",A genome-wide association study identifies two susceptibility loci for duodenal ulcer in the Japanese population,,,,1040.0,4,Nature Genetics,English,Embase Medline,430-434,,,44.0,2012,Kiana.Martinez,3,Yes,rs505922,rs8176746,,,,2,No,No,No,,Yes,32358,Japanese,0,0,32358,0,0,0,duodenal ulcer,GWAS,"HumanHap610K, Invader assay, HumanHap550K, TaqMan assay",No,No,No,No,No,unclear,Some genomic data imputed
1795,"Toure, O.,Konate, S.,Sissoko, S.,Niangaly, A.,Barry, A.,Sall, A. H.,Diarra, E.,Poudiougou, B.,Sepulveda, N.,Campino, S.,Rockett, K. A.,Clark, T. G.,Thera, M. A.,Doumbo, O.",Candidate Polymorphisms and Severe Malaria in a Malian Population,,,,1069.0,9,PLoS ONE,English,Embase Medline,,,,7.0,2012,Kiana.Martinez,3,Yes,rs8176719,rs8176746,,,,2,No,No,No,,Yes,934,"recruited from Bamako, Mali",934,0,0,0,0,0,malaria,case-control study; association study,Sequenom MassArray genotyping,No,No,No,Yes,No,No,
1803,"Tsuchimine, S.,Saruwatari, J.,Kaneda, A.,Yasui-Furukori, N.",ABO Blood Type and Personality Traits in Healthy Japanese Subjects,25978647,Nlm,,1077.0,5,PLoS One,eng,PubMed,e0126983,,,10.0,2015,Kiana.Martinez,3,Yes,rs8176719,rs8176746,,,,2,No,No,No,,Yes,1427,Japanese,0,0,1427,0,0,0,personality traits,qualitative study,TaqMan allele-specific assay,No,No,No,No,No,No,
1813,"Van Alsten, S. C.,Aversa, J. G.,Santo, L.,Camargo, M. C.,Kemp, T.,Liu, J.,Huang, W. Y.,Sampson, J.,Rabkin, C. S.",Association between ABO and Duffy blood types and circulating chemokines and cytokines,34103707,Nlm,Jul,1087.0,3,Genes Immun,eng,PubMed,161-171,,,22.0,2021,Kiana.Martinez,3,Yes,rs8176719,"rs7853989, rs8176720",,,rs1053878,4,Yes,No,No,,Yes,4327,non-Hispanic white,0,0,0,4327,0,0,circulating chemokines and cytokines,association study,"Global Screening Array, Oncoarray, OmniX, or Omni 2.5",No,No,No,No,No,unclear,Genomic data imputed
1853,"Weiss, F. U.,Schurmann, C.,Guenther, A.,Ernst, F.,Teumer, A.,Mayerle, J.,Simon, P.,VÃ¶lzke, H.,Radke, D.,Greinacher, A.,Kuehn, J. P.,Zenker, M.,VÃ¶lker, U.,Homuth, G.,Lerch, M. M.","Fucosyltransferase 2 (FUT2) non-secretor status and blood group B are associated with elevated serum lipase activity in asymptomatic subjects, and an increased risk for chronic pancreatitis: a genetic association study",25028398,Nlm,Apr,1127.0,4,Gut,eng,PubMed,646-56,,,64.0,2015,Kiana.Martinez,3,Yes,rs8176719,rs8176747,,,rs8176750,3,No,Yes,No,,Yes,unclear,German,0,0,0,unclear,0,0,serum lipase activit,GWAS,TaqMan PCR,No,No,No,No,No,No,Genomic data imputed
1888,"Wolpin, B. M.,Kraft, P.,Xu, M.,Steplowski, E.,Olsson, M. L.,Arslan, A. A.,Bueno-de-Mesquita, H. B.,Gross, M.,Helzlsouer, K.,Jacobs, E. J.,LaCroix, A.,Petersen, G.,Stolzenberg-Solomon, R. Z.,Zheng, W.,Albanes, D.,Allen, N. E.,Amundadottir, L.,Austin, M. A.,Boutron-Ruault, M. C.,Buring, J. E.,Canzian, F.,Chanock, S. J.,Gaziano, J. M.,Giovannucci, E. L.,Hallmans, G.,Hankinson, S. E.,Hoover, R. N.,Hunter, D. J.,Hutchinson, A.,Jacobs, K. B.,Kooperberg, C.,Mendelsohn, J. B.,Michaud, D. S.,Overvad, K.,Patel, A. V.,SanchÃ©z, M. J.,Sansbury, L.,Shu, X. O.,Slimani, N.,Tobias, G. S.,Trichopoulos, D.,Vineis, P.,Visvanathan, K.,Virtamo, J.,Wactawski-Wende, J.,Watters, J.,Yu, K.,Zeleniuch-Jacquotte, A.,Hartge, P.,Fuchs, C. S.","Variant ABO blood group alleles, secretor status, and risk of pancreatic cancer: results from the pancreatic cancer cohort consortium",20971884,Nlm,Dec,1162.0,12,Cancer Epidemiol Biomarkers Prev,eng,PubMed,3140-9,,,19.0,2010,Kiana.Martinez,3,Yes,rs505922,rs8176746,,,rs8176704,4,Yes,No,No,,Yes,4905,White,0,0,0,4905,0,0,pancreatic cancer,case-control study; association study,Illumina 550 HumanHap assay,No,Yes (rs574347),No,Yes,No,unclear,
1893,"Wu, P.,Ding, L.,Li, X.,Liu, S.,Cheng, F.,He, Q.,Xiao, M.,Wu, P.,Hou, H.,Jiang, M.,Long, P.,Wang, H.,Liu, L.,Qu, M.,Shi, X.,Jiang, Q.,Mo, T.,Ding, W.,Fu, Y.,Han, S.,Huo, X.,Zeng, Y.,Zhou, Y.,Zhang, Q.,Ke, J.,Xu, X.,Ni, W.,Shao, Z.,Wang, J.,Liu, P.,Li, Z.,Jin, Y.,Zheng, F.,Wang, F.,Liu, L.,Li, W.,Liu, K.,Peng, R.,Xu, X.,Lin, Y.,Gao, H.,Shi, L.,Geng, Z.,Mu, X.,Yan, Y.,Wang, K.,Wu, D.,Hao, X.,Cheng, S.,Qiu, G.,Guo, H.,Li, K.,Chen, G.,Sun, Z.,Lin, X.,Jin, X.,Wang, F.,Sun, C.,Wang, C.",Trans-ethnic genome-wide association study of severe COVID-19,34465887,Nlm,31-Aug,1167.0,1,Commun Biol,eng,PubMed,1034,,,4.0,2021,Kiana.Martinez,3,Yes,rs8176719,,,,,1,Yes,No,No,,Yes,4947,Chinese,0,0,4947,0,0,0,COVID-19,GWAS,Illumina Global Screening Array,No,No,No,Yes,No,unclear,Genomic data imputed
1906,"Yabe, M.,Matsubara, Y.,Takahashi, S.,Ishihara, H.,Shibano, T.,Watanabe, G.,Murata, M.,Ikeda, Y.",Alpha 2A adrenergic receptor polymorphism is associated with plasma von Willebrand factor levels in a general population,18600088,Nlm,Jul,1180.0,5,Blood Coagul Fibrinolysis,eng,PubMed,395-9,,,19.0,2008,Kiana.Martinez,3,Yes,rs8176719,rs8176743,,,rs1053878,4,Unclear,No,No,,Yes,277,Japanese,0,0,277,0,0,0,plasma von Willebrand factor levels,cohort study,single nucleotide primer extension-based method with the MegaBACE1000,No,Yes (rs8176751),No,No,No,No,
1912,"Yamamura, K.,Ihara, K.,Ikeda, K.,Nagata, H.,Mizuno, Y.,Hara, T.",Histo-blood group gene polymorphisms as potential genetic modifiers of the development of coronary artery lesions in patients with Kawasaki disease,22117627,Nlm,Apr,1186.0,2,Int J Immunogenet,eng,PubMed,119-25,,,39.0,2012,Kiana.Martinez,3,Yes,rs8176719,"rs8176746, rs8176747",,,,3,Unclear,Yes,No,,Yes,737,recruited from Japanese hospital,0,0,737,0,0,0,"Kawasaki disease, coronary artery lesions",association study; case-control study,TaqMan SNP assay,"Yes (rs8176747, rs8176746)",No,No,Yes,No,No,
1926,"Ye, B. D.,Kim, B. M.,Jung, S.,Lee, H. S.,Hong, M.,Kim, K.,Moon, J. W.,Baek, J.,Oh, E. H.,Hwang, S. W.,Park, S. H.,Yang, S. K.,Song, K.",Association of FUT2 and ABO with Crohn's disease in Koreans,31260595,Nlm,Jan,1200.0,1,J Gastroenterol Hepatol,eng,PubMed,104-109,,,35.0,2020,Kiana.Martinez,3,Yes,"rs8176719, rs687289",rs8176746,,,,3,No,No,Yes,r2=0.97_rs8176719_rs687289,Yes,9809,Korean,0,0,9809,0,0,0,Crohn's disease,association study,TaqMan SNP genotyping assay,No,No,No,Yes,No,No,
1963,"Zhang, M.,Lykke-Andersen, S.,Zhu, B.,Xiao, W.,Hoskins, J. W.,Zhang, X.,Rost, L. M.,Collins, I.,Bunt, M. V.,Jia, J.,Parikh, H.,Zhang, T.,Song, L.,Jermusyk, A.,Chung, C. C.,Zhu, B.,Zhou, W.,Matters, G. L.,Kurtz, R. C.,Yeager, M.,Jensen, T. H.,Brown, K. M.,Ongen, H.,Bamlet, W. R.,Murray, B. A.,McCarthy, M. I.,Chanock, S. J.,Chatterjee, N.,Wolpin, B. M.,Smith, J. P.,Olson, S. H.,Petersen, G. M.,Shi, J.,Amundadottir, L.",Characterising cis-regulatory variation in the transcriptome of histologically normal and tumour-derived pancreatic tissues,28634199,Nlm,Mar,1237.0,3,Gut,eng,PubMed,521-533,,,67.0,2018,Kiana.Martinez,3,Yes,"rs8176719, rs687289",,,,,2,Unclear,No,Yes,r2=0.97_rs8176719_rs687289,No,219,European ancestry,0,0,0,219,0,0,histologically normal and tumour derived pancreatic tissues,eQTL study,"Illumina OmniExpress, Omni1M arrays,  Affymetrix 6.0 arrays",No,No,No,Yes,No,unclear,Genomic data imputed
1967,"Zhao, S. X.,Xue, L. Q.,Liu, W.,Gu, Z. H.,Pan, C. M.,Yang, S. Y.,Zhan, M.,Wang, H. N.,Liang, J.,Gao, G. Q.,Zhang, X. M.,Yuan, G. Y.,Li, C. G.,Du, W. H.,Liu, B. L.,Liu, L. B.,Chen, G.,Su, Q.,Peng, Y. D.,Zhao, J. J.,Ning, G.,Huang, W.,Liang, L.,Qi, L.,Chen, S. J.,Chen, Z.,Chen, J. L.,Song, H. D.,China Consortium for the Genetics of Autoimmune Thyroid, Disease",Robust evidence for five new Graves' disease risk loci from a staged genome-wide association analysis,23612905,Ovid Technologies,15-Aug,1241.0,16,Human Molecular Genetics,English,MEDLINE,3347-62,,,22.0,2013,Kiana.Martinez,3,Yes,rs505922,rs8176746,,,,2,No,No,No,,Yes,18680,Chinese Han,0,0,18680,0,0,0,Graves' disease,case-control study;,"Illumina Human660-Quad BeadChips, TaqMan SNP genotyping, ABI 7900HT Fast Real-Time PCR System",No,No,No,No,No,unclear,Genomic data imputed
1970,"Zhu, Y.,Liang, Y.,Khan, A. H.,Dong, M.,Wan, Y.,Sun, Z.,Zeng, Y.,Nie, C.,Tian, X. L.",Allelic distribution of ABO gene in Chinese centenarians,,,,1244.0,3,Aging Medicine,English,Embase,195-204,,,3.0,2020,Kiana.Martinez,3,Yes,rs687289,"rs8176743, rs8176746, rs8176749",rs507666,,,5+,Unclear,No,No,,Yes,4494,Chinese,0,0,4494,0,0,0,ABO,association study,"Illumina HumanOmniZhongHua-8 BeadChips, looked for frequency of specifc ABO SNPS","Yes (rs8176743, rs8176746, rs8176749)","Yes (rs688976, rs549446, rs512770)",No,Yes,No,unclear,
