refid,author,title,accession_num,database_provider,date,id,issue,journal,language,database_name,pages,publication,publisher,volume,year,user,level,snps,o_snps,b_snps,a_snps,a1_snps,a2_snps,snp_num,haplotype,sero,ld,ld_score,sig_result,cohort_total,pop_descrip,afr,amr,eas,eur,sas,other,pheno,study,seq,multi_b_snps,o2,subtypes,o_v_nono,diversity,imputed,notes
1032,"Galeotti, A. A.,Gentiluomo, M.,Rizzato, C.,Obazee, O.,Neoptolemos, J. P.,Pasquali, C.,Nentwich, M.,Cavestro, G. M.,Pezzilli, R.,Greenhalf, W.,Holleczek, B.,Schroeder, C.,SchÃ¶ttker, B.,Ivanauskas, A.,Ginocchi, L.,Key, T. J.,Hegyi, P.,Archibugi, L.,Darvasi, E.,Basso, D.,Sperti, C.,Bijlsma, M. F.,Palmieri, O.,Hlavac, V.,Talar-Wojnarowska, R.,Mohelnikova-Duchonova, B.,Hackert, T.,Vashist, Y.,Strouhal, O.,van Laarhoven, H.,Tavano, F.,Lovecek, M.,Dervenis, C.,IzbÃ©ki, F.,Padoan, A.,MaÅ‚ecka-Panas, E.,Maiello, E.,Vanella, G.,Capurso, G.,Izbicki, J. R.,Theodoropoulos, G. E.,Jamroziak, K.,Katzke, V.,Kaaks, R.,Mambrini, A.,Papanikolaou, I. S.,Szmola, R.,Szentesi, A.,Kupcinskas, J.,Bursi, S.,Costello, E.,Boggi, U.,Milanetto, A. C.,Landi, S.,Gazouli, M.,Vodickova, L.,Soucek, P.,Gioffreda, D.,Gemignani, F.,Brenner, H.,Strobel, O.,BÃ¼chler, M.,Vodicka, P.,Paiella, S.,Canzian, F.,Campa, D.",Polygenic and multifactorial scores for pancreatic ductal adenocarcinoma risk prediction,32591343,Nlm,Jun,306.0,6,J Med Genet,eng,PubMed,369-377,,,58.0,2021,Kiana.Martinez,3,Yes,rs505922,rs8176746,,,,2,No,No,No,,Yes,6779,European,0,0,0,6779,0,0,pancreatic ductal adenocarcinoma,polygenic risk score study; association study; case-control study,TaqMan genotyping,No,No,No,No,No,No,
1036,"Garcia-MartÃ­nez, I.,BorrÃ s, N.,Martorell, M.,Parra, R.,Altisent, C.,RamÃ­rez, L.,Ãlvarez-RomÃ¡n, M. T.,NuÃ±ez, R.,Megias-Vericat, J. E.,Corrales, I.,Alonso, S.,Vidal, F.",Common Genetic Variants in ABO and CLEC4M Modulate the Pharmacokinetics of Recombinant FVIII in Severe Hemophilia A Patients,32726853,Nlm,Oct,310.0,10,Thromb Haemost,eng,PubMed,1395-1406,,,120.0,2020,Kiana.Martinez,3,Yes,rs8176719,rs8176747,,,,3,No,No,No,,Yes,43,recruited from Spanish hospitals,0,0,0,43,0,0,hemophilia A,prospective study; association study,ABO SNP variant,No,No,Yes; O3 (rs7853989 ),Yes,No,No,
1039,"Garvert, L.,Baune, B. T.,Berger, K.,Boomsma, D. I.,Breen, G.,Greinacher, A.,Hamilton, S. P.,Levinson, D. F.,Lewis, C. M.,Lucae, S.,Magnusson, P. K. E.,Martin, N. G.,McIntosh, A. M.,Mors, O.,MÃ¼ller-Myhsok, B.,Penninx, B. W. J. H.,Perlis, R. H.,Pistis, G.,Potash, J. B.,Preisig, M.,Rietschel, M.,Shi, J.,Smoller, J. W.,Tiemeier, H.,Uher, R.,VÃ¶lker, U.,VÃ¶lzke, H.,Weissman, M. M.,Grabe, H. J.,Van der Auwera, S.",The association between genetically determined ABO blood types and major depressive disorder,,,,313.0,,Psychiatry Research,English,Embase Medline,,,,299.0,2021,Kiana.Martinez,3,Yes,rs505922,"rs8176746, rs8176747",,,,3,No,No,Yes,r2=0.87_rs8176719_rs505922,No,37208,largely European ancestry,0,0,0,37208,0,0,major depressive disorder,pooled case-control study,"arrays: I550, PSYC, A5.0, A6.0, I650, OMEX, I317, COEX",No,No,No,Yes,No,No,"Also did a A vs non-A, B vs non-B, AB vs non-AB."
1044,"Gates, M. A.,Xu, M.,Chen, W. Y.,Kraft, P.,Hankinson, S. E.,Wolpin, B. M.",ABO blood group and breast cancer incidence and survival,21633955,Nlm,1-May,318.0,9,Int J Cancer,eng,PubMed,2129-37,,,130.0,2012,Kiana.Martinez,3,Yes,rs505922,rs8176746,,,rs8176704,3,Yes,Yes,No,,No,2228,self-reported European ancestry,0,0,0,2228,0,0,invasive breast cancer,case-control study; association study,Illumina HumanHap500 array,No,No,No,No,No,unclear,
1083,"Groot, H. E.,Villegas Sierra, L. E.,Said, M. A.,Lipsic, E.,Karper, J. C.,van der Harst, P.",Genetically Determined ABO Blood Group and its Associations With Health and Disease,31969017,Nlm,Mar,357.0,3,Arterioscler Thromb Vasc Biol,eng,PubMed,830-838,,,40.0,2020,Kiana.Martinez,3,Yes,rs8176719,rs8176746,,,,2,No,No,No,,Yes,406755,UK Biobank,unclear,unclear,unclear,unclear,unclear,unclear,41 health and disease outcomes; ABO blood types,association study,"UK Biobank Lung Exome Variant Evaluation Axiom,  UK Biobank Axiom array",No,No,No,Yes,Unclear,unclear,Excluded bloodtypes with AB; come genotype data included
1124,"Hermanns, M. I.,Grossmann, V.,Spronk, H. M. H.,Schulz, A.,JÃ¼nger, C.,Laubert-Reh, D.,Mazur, J.,Gori, T.,Zeller, T.,Pfeiffer, N.,Beutel, M.,Blankenberg, S.,MÃ¼nzel, T.,Lackner, K. J.,Cate-Hoek, A. J. T.,Cate, H. T.,Wild, P. S.","Distribution, genetic and cardiovascular determinants of FVIII:c - Data from the population-based Gutenberg Health Study",,,,398.0,1,International Journal of Cardiology,English,Embase,166-174,,,187.0,2015,Kiana.Martinez,3,Yes,"rs657152, rs612169",rs8176672,,,rs651007,4,Yes,No,Yes,r2=0.96_rs507666_rs612169,Yes,4175,Gutenberg Health Study,0,0,0,4175,0,0,plasma FVIII:c,cohort study,Affymetrix Genome-Wide Human SNP 6.0 Array,No,No,No,Yes ,No,unclear,Did genotype imputation
1139,"HÃ¶glund, J.,Karlsson, T.,Johansson, T.,Ek, W. E.,Johansson, ",Characterization of the human ABO genotypes and their association to common inflammatory and cardiovascular diseases in the UK Biobank,,,,413.0,11,American Journal of Hematology,English,Embase Medline,1350-1362,,,96.0,2021,Kiana.Martinez,3,Yes,rs8176719,"rs8176746, rs8176747",,,rs1053878,4,Yes,No,No,,Yes,361975,"UK Biobank, Caucasian subset",0,0,0,361975,0,0,common inflammatory and cardiovascular diseases,association study,UK BiLEVE array and Axiom array,"Yes (rs8176746, rs8176747)",No,No,Yes,No,unclear,Some genomic data imputed
1149,"Horvei, L. D.,Braekkan, S. K.,Smith, E. N.,Solomon, T.,Hindberg, K.,Frazer, K. A.,Rosendaal, F. R.,Hansen, J. B.",Joint effects of prothrombotic genotypes and body height on the risk of venous thromboembolism: the TromsÃ¸ study,29094466,Nlm,Jan,423.0,1,J Thromb Haemost,eng,PubMed,83-89,,,16.0,2018,Kiana.Martinez,3,Yes,rs8176719,,,,,1,No,No,No,,Unclear,2518,population from Norway,0,0,0,2518,0,0,venous thromboembolism,cohort study,Sequenom iPlex Gold Assay,No,No,No,No,No,No,Called the rs8176719 a blood type SNP but didn't look closely at blood groups
1183,"James, P. D.,Paterson, A. D.,Notley, C.,Cameron, C.,Hegadorn, C.,Tinlin, S.,Brown, C.,O'Brien, L.,Leggo, J.,Lilllicrap, D.",Genetic linkage and association analysis in type 1 von Willebrand disease: Results from the Canadian Type 1 VWD Study,,,,457.0,4,Journal of Thrombosis and Haemostasis,English,Embase Medline,783-792,,,4.0,2006,Kiana.Martinez,3,Yes,rs8176719,rs8176743,,,,2,No,No,No,,Yes,unclear,The Canadian Type 1 VWD Study,unclear,unclear,unclear,unclear,unclear,unclear,type 1 von Willebrand disease,linkage study; association study,genotyped using the 5â€²-nuclease assay,No,No,No,No,Unclear,No,"Never described the number of individuals, only number of families"
1195,"Johansson, ",Genome-Wide Association Study Identifies That the ABO Blood Group System Influences Interleukin-10 Levels and the Risk of Clinical Events in Patients with Acute Coronary Syndrome,26600159,Nlm,,469.0,11,PLoS One,eng,PubMed,e0142518,,,10.0,2015,Kiana.Martinez,3,Yes,rs687289,rs8176746,,,rs507666,3,Yes,No,No,,Yes,3345,Scandinavian & Swedish,0,0,0,3345,0,0,acute coronary syndrome,GWAS; case-control study,Illumina CardioMetaboChip Genotyping BeadChip,No,No,No,No,No,No,
1200,"Jongruamklang, P.,Gassner, C.,Meyer, S.,Kummasook, A.,Darlison, M.,Boonlum, C.,Chanta, S.,Frey, B. M.,Olsson, M. L.,Storry, J. R.",Matrix-assisted laser desorption/ionization time-of-flight mass spectrometry analysis of 36 blood group alleles among 396 Thai samples reveals region-specific variants,,,,474.0,7,Transfusion,English,Embase Medline,1752-1762,,,58.0,2018,Kiana.Martinez,3,Yes,rs8176719,,,,,1,No,Yes,No,,No,396,Thai,0,0,396,0,0,0,blood group alleles,methods paper,MALDI-TOF MS platform (MassARRAY),No,No,No,No,No,No,Concoradance looked at between O blood types derived from SNP and serology; stats done with serology data
1211,"Karnes, J. H.,Rollin, J.,Giles, J. B.,Martinez, K. L.,Steiner, H. E.,Shaffer, C. M.,Momozawa, Y.,Inai, C.,Bombin, A.,Shi, M.,Mosley, J. D.,Stanaway, I.,Selleng, K.,Thiele, T.,Mushiroda, T.,Pouplard, C.,Heddle, N. M.,Kubo, M.,Phillips, E. J.,Warkentin, T. E.,Gruel, Y.,Greinacher, A.,Roden, D. M.",ABO O blood group as a risk factor for platelet reactivity in heparin-induced thrombocytopenia,35377938,Nlm,21-Jul,485.0,3,Blood,eng,PubMed,274-284,,,140.0,2022,Kiana.Martinez,3,Yes,rs8176719,rs8176746,,,,2,Yes,No,No,,Yes,4952,"European, African, Asian, Admixed",13,0,6,4856,0,77,heparin-induced thrombocytopenia,GWAS,lllumina Infinium HumanOmniExpressExome BeadChip &  Multiplex PCR-based target sequencing for ABO,No,No,No,No,Yes,No,
1218,"Kayama, T.,Yamashita, H.,Fukao, A.,Kubota, I.,Kato, T.,Kitanaka, C.,Sato, S.,Ueno, Y.,Konta, T.,Shibata, Y.,Watanabe, T.,Abe, S.,Miyamoto, T.,Inoue, S.,Miyashita, T.,Ichikawa, K.,Shishido, T.,Arimoto, T.,Takahashi, H.,Nishiyama, S.,Ikeda, A.,Daimon, M.,Kawanami, T.,Wada, M.,Arawaka, S.,Oizumi, H.,Kurokawa, K.,Susa, S.,Katou, Y.,Kameda, W.,Koyama, S.,Karasawa, S.,Iseki, C.,Takahashi, Y.,Kawata, S.,Saito, T.,Makino, N.,Okumoto, K.,Haga, H.,Sato, T.,Sato, C.,Watanabe, H.,Nishise, Y.,Ishii, R.,Matsuda, A.,Tozawa, T.,Honma, K.,Narimatsu, H.,Shibata, K.,Miura, A.,Inoue, R.,Numazawa, A.,Kudo, K.,Aita, Y.,Umezawa, N.,Saito, Y.,Takahashi, Y.,Suzuki, Y.,Otani, K.,Hozawa, A.,Shao, L.,Orui, M.,Kobayashi, A.,Kanoya, Y.,Hosoya, T.,Suzuki, I.,Otake, M.,Morikagi, Y.,Sekimata, A.,Hiraka, M.,Matsuda, Y.,Takeda, Y.,Matsunami, Y.,Horie, T.,Sato, S.,Inoue, M.,Baba, K.,Tamiya, G.,Ueki, M.,Nakamura, T.,Jambaldorj, J.,Araki, S.,Nakajima, O.,Takahashi, K.,Goto, K.,Ishizaka, K.",Pleiotropic effect of common variants at ABO glycosyltranferase locus in 9q32 on plasma levels of pancreatic lipase and angiotensin converting enzyme,,,,492.0,2,PLoS ONE,English,Embase Medline,,,,9.0,2014,Kiana.Martinez,3,Yes,rs505922,rs8176746,,,,2,Yes,No,No,,Yes,1252,Japanese,0,0,1252,0,0,0,plasma levels of pancreatic lipase and angiotensin converting enzyme,GWAS,Illumina 600K SNP BeadChip,No,No,No,No,No,"Yes (rs505922, rs8176746)",Genotype data imputed
1229,"Ken-Dror, G.,Cotlarciuc, I.,Martinelli, I.,Grandone, E.,Hiltunen, S.,Lindgren, E.,Margaglione, M.,Duchez, V. L. C.,Triquenot, A. B.,Zedde, M.,Mancuso, M.,Ruigrok, Y. M.,Marjot, T.,Worrall, B.,Majersik, J. J.,Metso, T. M.,Putaala, J.,Haapaniemi, E.,Zuurbier, S. M.,Brouwer, M. C.,Passamonti, S. M.,Abbattista, M.,Bucciarelli, P.,Mitchell, B. D.,Kittner, S. J.,Lemmens, R.,Jern, C.,Pappalardo, E.,Costa, P.,Colombi, M.,de Sousa, D. A.,Rodrigues, S.,CanhÃ£o, P.,Tkach, A.,Santacroce, R.,Favuzzi, G.,Arauz, A.,Colaizzo, D.,Spengos, K.,Hodge, A.,Ditta, R.,Pezzini, A.,Debette, S.,Coutinho, J. M.,Thijs, V.,Jood, K.,Pare, G.,Tatlisumak, T.,Ferro, J. M.,Sharma, P.",Genome-Wide Association Study Identifies First Locus Associated with Susceptibility to Cerebral Venous Thrombosis,,,,503.0,5,Annals of Neurology,English,Embase Medline,777-788,,,90.0,2021,Kiana.Martinez,3,Yes,rs8176645,rs8176746,,,,2,Yes,No,Yes,r2=0.98_rs8176719_rs8176645,Yes,2087,European,0,0,0,2087,0,0,cerebral venous thrombosis,GWAS; case-control study,Illumina HumanCoreExome BeadChip v1.0,No,No,No,Yes,No,No,
1252,"Krawczyk, M.,Mihalache, F.,Hoblinger, A.,Acalovschi, M.,Lammert, F.,Zimmer, V.",Pancreatic cancer risk variant ABO rs505922 in patients with cholangiocarcinoma,22147973,Ovid Technologies,7-Nov,526.0,41,World Journal of Gastroenterology,English,MEDLINE,4640-2,,,17.0,2011,Kiana.Martinez,3,Yes,rs505922,,,,,1,No,No,No,,No,530,European,0,0,0,530,0,0,cholangiocarcinoma,case-control study; association study,Taq Man Probes,No,No,No,Yes,No,No,
1266,"Lanke, E.,Johansson, A. M.,HalldÃ©n, C.,Lethagen, S.",Genetic analysis of 31 Swedish type 1 von Willebrand disease families reveals incomplete linkage to the von Willebrand factor gene and a high frequency of a certain disease haplotype,16359504,Nlm,Dec,540.0,12,J Thromb Haemost,eng,PubMed,2656-63,,,3.0,2005,Kiana.Martinez,3,Yes,rs8176719,,,,,1,No,No,No,,Yes,290,Swedish,0,0,0,290,0,0,type 1 von Willebrand disease,linkage study; family study,Sequenom MassARRAY,No,No,No,Yes,No,No,
1286,"Lehrer, S.,Rheinstein, P. H.","ABO blood groups, COVID-19 infection and mortality",33894687,Nlm,Jul,560.0,,Blood Cells Mol Dis,eng,PubMed,102571,,,89.0,2021,Kiana.Martinez,3,Yes,"rs8176719, rs505922",rs8176746,,,,3,Unclear,No,No,,No,12575,98% were white British,0,0,0,12324,0,251,COVID-19,qualitative study,UK Biobank Axiom Array,No,No,No,No,Yes,unclear,For those without rs8176719 used rs505922 for O; only did Fisher's exact test
1303,"Li, J.,Gui, L.,Wu, C.,He, Y.,Zhou, L.,Guo, H.,Yuan, J.,Yang, B.,Dai, X.,Deng, Q.,Huang, S.,Guan, L.,Hu, D.,Deng, S.,Wang, T.,Zhu, J.,Min, X.,Lang, M.,Li, D.,Yang, H.,Hu, F. B.,Lin, D.,Wu, T.,He, M.",Genome-wide association study on serum alkaline phosphatase levels in a Chinese population,,,,577.0,1,BMC Genomics,English,Embase Medline,,,,14.0,2013,Kiana.Martinez,3,Yes,rs505922,rs8176746,,,,2,Unclear,No,No,,Yes,10291,Chinese,0,0,10291,0,0,0,serum alkaline phosphatase,GWAS,Affymetrix Genome-Wide Human SNP Array 6.0 chips. iPLEX system for genotyping,No,No,No,No,No,unclear,Imputed some genomic data
1305,"Li, Lian,Wang, Chao,Zhou, Jingjing,Wang, Lili,Xing, Tongyu,Dai, Hongji,Zhou, Yao,Qi, Lisha,Zhao, Yanrui,Huang, Caiyun",ABO blood groups and expression of blood group antigens of epithelial ovarian cancer in Chinese women,,,,579.0,,,,Google Scholar,,,,,2022,Kiana.Martinez,3,Yes,rs687289,rs8176746,,,,2,Unclear,No,Yes,r2=1_rs8176719_rs687289,Yes,6699,Chinese women,0,0,6699,0,0,0,epithelial ovarian cancer,case-control study; association study,genotype data were obtained from our previous genome-wide association study,No,No,No,No,No,unclear,Cohort from dozens of different studies
1308,"Li, S.,Schooling, C. M.",A phenome-wide association study of ABO blood groups,33198801,Nlm,17-Nov,582.0,1,BMC Med,eng,PubMed,334,,,18.0,2020,Kiana.Martinez,3,Yes,rs687289,rs8176746,,rs507666,rs8176704,4,Unclear,No,Yes,r2=0.99_rs8176750_rs8176704; r2=0.97_rs8176719_rs687289,Yes,~500000,UK Biobank,unclear,unclear,unclear,unclear,unclear,unclear,PheWAS of ABO blood groups,PheWAS,UK Biobank Axiom Array,No,No,No,No,Unclear,No,PheWAS so multiple subsets of the UK BioBank so ~ 500000 n included; don't think ABO snps were imputed because they based tSNP based on data availability
1315,"Liang, Y.,Tang, W.,Huang, T.,Gao, Y.,Tan, A.,Yang, X.,Zhang, H.,Hu, Y.,Qin, X.,Li, S.,Zhang, S.,Mo, L.,Liang, Z.,Shi, D.,Huang, Z.,Guan, Y.,Zhou, J.,Winkler, C.,O'Brien, S. J.,Xu, J.,Mo, Z.,Peng, T.",Genetic variations affecting serum carcinoembryonic antigen levels and status of regional lymph nodes in patients with sporadic colorectal cancer from southern China,,,,589.0,6,PLoS ONE,English,Embase Medline,,,,9.0,2014,Kiana.Martinez,3,Yes,rs687289,rs8176746,,rs507666,rs8176704,4,No,Yes,No,,No,1999,Han Chinese,0,0,1999,0,0,0,"colorectal cancer, serum carcinoembryonic antigen",GWAS,Illumina Omni 1 M chip,No,No,No,No,No,unclear,
1366,"Maiga, B.,Dolo, A.,Campino, S.,Sepulveda, N.,Corran, P.,Rockett, K. A.,Troye-Blomberg, M.,Doumbo, O. K.,Clark, T. G.","Glucose-6-phosphate dehydrogenase polymorphisms and susceptibility to mild malaria in Dogon and Fulani, Mali",,,,640.0,1,Malaria Journal,English,Embase Medline,,,,13.0,2014,Kiana.Martinez,3,Yes,rs8176719,rs8176746,,,,2,Unclear,No,No,,Yes,712,African,712,0,0,0,0,0,malaria,cohort study; association study,Sequenom IPLEX genotyping platform,No,No,No,No,No,unclear,
1372,"Manderstedt, E.,Lind-HalldÃ©n, C.,Lethagen, S.,HalldÃ©n, C.",Common and rare variants in genes associated with von willebrand factor level variation: No accumulation of rare variants in swedish von willebrand disease patients,,,,646.0,4,TH Open,English,Embase,E322-E331,,,4.0,2020,Kiana.Martinez,3,Yes,unclear,unclear,unclear,unclear,unclear,,Unclear,No,No,,No,104,Swedish,0,0,0,104,0,0,von Willebrand disease,case-control study; association study,TaqMan assays; Ion Torrent sequencing,Unclear,No,No,Yes,No,unclear,Doesn't describe at all how ABO was determined using SNPs except that we know it was
1381,"Markt, S. C.,Shui, I. M.,Unger, R. H.,Urun, Y.,Berg, C. D.,Black, A.,Brennan, P.,Bueno-de-Mesquita, H. B.,Gapstur, S. M.,Giovannucci, E.,Haiman, C.,Henderson, B.,Hoover, R. N.,Hunter, D. J.,Key, T. J.,Khaw, K. T.,Canzian, F.,Larranga, N.,Le Marchand, L.,Ma, J.,Naccarati, A.,Siddiq, A.,Stampfer, M. J.,Stattin, P.,Stevens, V. L.,Stram, D. O.,TjÃ¸nneland, A.,Travis, R. C.,Trichopoulos, D.,Ziegler, R. G.,Lindstrom, S.,Kraft, P.,Mucci, L. A.,Choueiri, T. K.,Wilson, K. M.",ABO blood group alleles and prostate cancer risk: Results from the breast and prostate cancer cohort consortium (BPC3),26268879,Nlm,Nov,655.0,15,Prostate,eng,PubMed,1677-81,,,75.0,2015,Kiana.Martinez,3,Yes,rs505922,rs8176746,,,rs8176704,3,Yes,No,Yes,r2=1_rs687289_rs505922,No,7217,European,0,0,0,7217,0,0,prostate cancer,case-control study; association study,Multiple SNP arrays from previous studies,No,No,No,No,No,unclear,No information on cohort ancestry or genotype information
1406,"McLachlan, S.,Giambartolomei, C.,White, J.,Charoen, P.,Wong, A.,Finan, C.,Engmann, J.,Shah, T.,Hersch, M.,Podmore, C.,Cavadino, A.,Jefferis, B. J.,Dale, C. E.,Hypponen, E.,Morris, R. W.,Casas, J. P.,Kumari, M.,Ben-Shlomo, Y.,Gaunt, T. R.,Drenos, F.,Langenberg, C.,Kuh, D.,Kivimaki, M.,Rueedi, R.,Waeber, G.,Hingorani, A. D.,Price, J. F.,Walker, A. P.",Replication and Characterization of Association between ABO SNPs and Red Blood Cell Traits by Meta-Analysis in Europeans,27280446,Nlm,,680.0,6,PLoS One,eng,PubMed,e0156914,,,11.0,2016,Kiana.Martinez,3,Yes,rs8176719,"rs8176746, rs8176747",,,,3,No,No,No,,Yes,13941,European ancestry,0,0,0,13941,0,0,red blood cell traits,GWAS; meta-analysis,Genotyped using Metabochip and imputed to the 100 Genomes,"Yes (rs8176746, rs8176747)",No,No,No,No,unclear,Genotype data imputed
1458,"Nakao, M.,Matsuo, K.,Ito, H.,Shitara, K.,Hosono, S.,Watanabe, M.,Ito, S.,Sawaki, A.,Iida, S.,Sato, S.,Yatabe, Y.,Yamao, K.,Ueda, R.,Tajima, K.,Hamajima, N.,Tanaka, H.","ABO genotype and the risk of gastric cancer, atrophic gastritis, and Helicobacter pylori infection",21680535,Nlm,Aug,732.0,8,Cancer Epidemiol Biomarkers Prev,eng,PubMed,1665-72,,,20.0,2011,Kiana.Martinez,3,Yes,rs8176719,"rs8176746, rs8176747",,,,3,No,No,No,,Yes,2168,Japanese,0,0,2168,0,0,0,"gastric cancer, atrophic gastritis,","case-control study; association study, Helicobacter pylori",TaqMan real-time PCR assay,"Yes (rs8176746, rs8176747)",No,No,No,No,No,
1461,"Namjou, B.,Marsolo, K.,Lingren, T.,Ritchie, M. D.,Verma, S. S.,Cobb, B. L.,Perry, C.,Kitchner, T. E.,Brilliant, M. H.,Peissig, P. L.,Borthwick, K. M.,Williams, M. S.,Grafton, J.,Jarvik, G. P.,Holm, I. A.,Harley, J. B.",A GWAS study on liver function test using eMERGE network participants,,,,735.0,9,PLoS ONE,English,Embase Medline,,,,10.0,2015,Kiana.Martinez,3,Yes,"rs505922, rs612169","rs8176746, rs8176672",rs8176704,,,5,Yes,No,No,,Yes,3294,European ancestry,0,0,0,3294,0,0,liver function,GWAS,"Affymetrix-Axiom, Illumina-610, Illumina-Omni-1, Illumina-Omni-5, Affymetrix-6, Illumina660W, Illumina-Omni-Express",Yes (rs8176746 orrs8176672),No,No,No,No,unclear,Genotype data imputed
1517,"Ozel, A. B.,McGee, B.,Siemieniak, D.,Jacobi, P. M.,Haberichter, S. L.,Brody, L. C.,Mills, J. L.,Molloy, A. M.,Ginsburg, D.,Li, J. Z.,Desch, K. C.",Genome-wide studies of von Willebrand factor propeptide identify loci contributing to variation in propeptide levels and von Willebrand factor clearance,27359253,Nlm,Sep,791.0,9,J Thromb Haemost,eng,PubMed,1888-98,,,14.0,2016,Kiana.Martinez,3,Yes,rs687289,rs8176749,,,rs8176704,3,Yes,No,No,,Yes,3452,"Genes and Blood Clotting Study, The Trinity Student Study",unclear,0,0,0,0,unclear,von Willebrand factor propeptide,GWAS; linkage study,Used the PLINK software to analyze prior Array based GWAS data,No,No,No,No,Yes,unclear,Genotype data imputed
1530,"Paquette, M.,Dufour, R.,Baass, A.",ABO blood group is a cardiovascular risk factor in patients with familial hypercholesterolemia,,,,804.0,2,Journal of Clinical Lipidology,English,Embase Medline,383-389.e1,,,12.0,2018,Kiana.Martinez,3,Yes,rs8176719,rs8176746,,,,2,Unclear,No,No,,Yes,668,Caucasians,0,0,0,668,0,0,familial hypercholesterolemia,association study,The Illumina HumanCoreExome-24 v10A microarray,No,No,No,Yes,No,unclear,Some genomic data imputed
1533,"ParÃ©, G.,Chasman, D. I.,Kellogg, M.,Zee, R. Y. L.,Rifai, N.,Badola, S.,Miletich, J. P.,Ridker, P. M.","Novel association of ABO histo-blood group antigen with soluble ICAM-1: Results of a genome-wide association study of 6,578 women",,,,807.0,7,PLoS Genetics,English,Embase Medline,,,,4.0,2008,Kiana.Martinez,3,Yes,rs687289,rs8176746,,rs507666,rs8176704,4,Yes,Yes,No,,Yes,6578,Caucasians,0,0,0,6578,0,0,soluble ICAM-1,GWAS,"Illumina HumanHap300 Duo-Plus chip, Illumina HumanHap300 Duo chip, Illumina I-Select chip",No,No,No,No,No,No,
1540,"Paterson, A. D.,Lopes-Virella, M. F.,Waggott, D.,Boright, A. P.,Hosseini, S. M.,Carter, R. E.,Shen, E.,Mirea, L.,Bharaj, B.,Sun, L.,Bull, S. B.,Diabetes, Control,Complications Trial/Epidemiology of Diabetes, Interventions,Complications Research, Group",Genome-wide association identifies the ABO blood group as a major locus associated with serum levels of soluble E-selectin,19729612,Ovid Technologies,Nov,814.0,11,"Arteriosclerosis, Thrombosis & Vascular Biology",English,MEDLINE,1958-67,,,29.0,2009,Kiana.Martinez,3,Yes,rs8176719,rs8176746,,,,2,No,No,No,,Yes,685,white individuals,0,0,0,685,0,0,serum levels of soluble E-selectin,GWAS,Taqman assay,No,No,No,No,No,No,
1558,"Plompen, E. P. C.,Darwish Murad, S.,Hansen, B. E.,Loth, D. W.,Schouten, J. N. L.,Taimr, P.,Hofman, A.,Uitterlinden, A. G.,Stricker, B. H.,Janssen, H. L. A.,Leebeek, F. W. G.",Prothrombotic genetic risk factors are associated with an increased risk of liver fibrosis in the general population: The Rotterdam Study,,,,832.0,6,Journal of Hepatology,English,Embase Medline,1459-1465,,,63.0,2015,Kiana.Martinez,3,Yes,rs505922,,,,,1,No,No,Yes,r2=1_rs687289_rs505922,Yes,1055,Dutch,0,0,0,1055,0,0,liver fibrosis,population-based cohort study; association study,Illumina Infinium II HumanHap 550K Genotyping Bead-ChipÂ® version 3,No,No,No,Yes,No,No,Genotype data imputed
1561,"Polfus, L. M.,Raffield, L. M.,Wheeler, M. M.,Tracy, R. P.,Lange, L. A.,Lettre, G.,Miller, A.,Correa, A.,Bowler, R. P.,Bis, J. C.,Salimi, S.,Jenny, N. S.,Pankratz, N.,Wang, B.,Preuss, M. H.,Zhou, L.,Moscati, A.,Nadkarni, G. N.,Loos, R. J. F.,Zhong, X.,Li, B.,Johnsen, J. M.,Nickerson, D. A.,Reiner, A. P.,Auer, P. L.",Whole genome sequence association with E-selectin levels reveals loss-of-function variant in African Americans,,,,835.0,3,Human Molecular Genetics,English,Embase Medline,515-523,,,28.0,2019,Kiana.Martinez,3,Yes,unclear,unclear,unclear,unclear,unclear,,Yes,No,No,,Yes,1147,African Americans,1147,0,0,0,0,0,E-selectin levels,cohort study; GWAS,whole genome sequence data,Unclear,Unclear,Unclear,No,No,unclear,Seems like they look at bloodtypes beyond the usual ones 
1565,"Poole, E. M.,Gates, M. A.,High, B. A.,Chanock, S. J.,Cramer, D. W.,Cunningham, J. M.,Fridley, B. L.,Gayther, S. A.,Goode, E. L.,Iversen, E. S.,Lissowska, J.,Weber, R. T. P.,Pharoah, P. D. P.,Phelan, C. M.,Ramus, S. J.,Schildkraut, J. M.,Sutphen, R.,Tsai, Y. Y.,Tyrer, J.,Vierkant, R. A.,Wentzensen, N.,Yang, H. P.,Terry, K. L.,Tworoger, S. S.",ABO blood group and risk of epithelial ovarian cancer within the Ovarian Cancer Association Consortium,,,,839.0,11,Cancer Causes and Control,English,Embase Medline,1805-1810,,,23.0,2012,Kiana.Martinez,3,Yes,"rs687289, rs505922",rs8176746,,,rs8176704,4,Unclear,No,No,,Yes,1326,European,0,0,0,1326,0,0,ovarian cancer,association study,"Illumina 610K, Taqman, Illumina iSelect, Illumina 550K",No,No,No,No,No,No,
1574,"Qi, L.,Cornelis, M. C.,Kraft, P.,Jensen, M.,van Dam, R. M.,Sun, Q.,Girman, C. J.,Laurie, C. C.,Mirel, D. B.,Hunter, D. J.,Rimm, E.,Hu, F. B.","Genetic variants in ABO blood group region, plasma soluble E-selectin levels and risk of type 2 diabetes",20147318,Nlm,1-May,848.0,9,Hum Mol Genet,eng,PubMed,1856-62,,,19.0,2010,Kiana.Martinez,3,Yes,rs612169,rs8176672,,,rs8176704,3,Unclear,No,No,,Yes,1005,European ancestry,0,0,0,1005,0,0,"plasma soluble E-selectin levels, type 2 diabetes",GWAS,Affymetrix Genome-Wide Human 6.0 array,No,No,No,No,No,unclear,
1576,"Qin, Y.,Havulinna, A. S.,Liu, Y.,Jousilahti, P.,Ritchie, S. C.,Tokolyi, A.,Sanders, J. G.,Valsta, L.,BroÅ¼yÅ„ska, M.,Zhu, Q.,Tripathi, A.,VÃ¡zquez-Baeza, Y.,Loomba, R.,Cheng, S.,Jain, M.,Niiranen, T.,Lahti, L.,Knight, R.,Salomaa, V.,Inouye, M.,MÃ©ric, G.",Combined effects of host genetics and diet on human gut microbiota and incident disease in a single population cohort,35115689,Nlm,Feb,850.0,2,Nat Genet,eng,PubMed,134-142,,,54.0,2022,Kiana.Martinez,3,Yes,rs687289,rs8176746,,rs507666,rs8176704,4,Yes,No,No,,Yes,5959,from Finland,0,0,0,5959,0,0,gut microbiota,population-based cohort,"Illumina genome-wide SNP arrays (the HumanCoreExome BeadChip, the Human610-Quad BeadChip and the HumanOmniExpress)",No,No,No,Yes,No,unclear,Genotype data imputed
1599,"Resende, S. S.,Milagres, V. G.,Chaves, D. G.,Fontes, C. J. F.,Carvalho, L. H.,Sousa, T. N.,Brito, C. F. A. D.",Increased susceptibility of blood type O individuals to develop anemia in Plasmodium vivax infection,,,,873.0,,"Infection, Genetics and Evolution",English,Embase Medline,87-92,,,50.0,2017,Kiana.Martinez,3,Yes,rs8176719,"rs8176746, rs8176749",,,rs1053878,5,No,No,No,,Yes,92,from the Brazilian Amazon,0,92,0,0,0,0,"Plasmodium vivax infection, anemia",association study,Real-Time PCR,"Yes (rs8176746, rs8176749)",Yes (rs8176720),No,Yes,No,No,
