refid,author,title,accession_num,database_provider,date,id,issue,journal,language,database_name,pages,publication,publisher,volume,year,user,level,snps,o_snps,b_snps,a_snps,a1_snps,a2_snps,snp_num,haplotype,sero,ld,ld_score,sig_result,cohort_total,pop_descrip,afr,amr,eas,eur,sas,other,pheno,study,seq,multi_b_snps,o2,subtypes,o_v_nono,diversity,imputed,notes
22,"Song, Jaewoo; Chen, Fengju; Campos, Marco; Bolgiano, Doug; Houck, Katie; Chambless, Lloyd E; Wu, Kenneth K; Folsom, Aaron R; Couper, David; Boerwinkle, Eric; ","Quantitative influence of ABO blood groups on factor VIII and its ratio to von Willebrand factor, novel observations from an ARIC study of 11,673 subjects",,,,,,,,,e0132626,PloS one,"Public Library of Science San Francisco, CA USA",10,2015,Kiana.Martinez,2,Yes,rs8176719,rs8176746,,,rs8176704,5,Unclear,No,No,,Yes,11673,"European,  African American",2856,0,0,8817,0,0,coagulation factor VIII,cohort study,Affymetrix 6.0 array,No,No,No,No,Yes,,"Unclear how they used the two other SNPs to classify A2 from everything else (rs8176749, rs8176704 [this one used for A2] and rs687289)"
44,"Ellinghaus, David; Degenhardt, Frauke; Bujanda, Luis; Buti, Maria; Albillos, Agustín; Invernizzi, Pietro; Fernández, Javier; Prati, Daniele; Baselli, Guido; Asselta, Rosanna; ",The ABO blood group locus and a chromosome 3 gene cluster associate with SARS-CoV-2 respiratory failure in an Italian-Spanish genome-wide association analysis,,,,,,,,,,MedRxiv,Cold Spring Harbor Laboratory Press,,2020,Kiana.Martinez,2,Yes,rs8176719,rs8176747,,,,3,Yes,No,No,,Yes,3815,"Italian, Spanish",0,0,0,3815,0,0,COVID-19,association study,Illumina’s Global Screening Array (GSA) version 2.0,No,Yes (rs41302905),No,No,No,,
49,"Zakai, Neil A; Judd, Suzanne E; Alexander, Kristine; McClure, Leslie A; Kissela, Brett M; Howard, George; Cushman, Mary; ",ABO blood type and stroke risk: The RE asons for Geographic and Racial Differences in Stroke Study,,,,,,,,,564-570,Journal of Thrombosis and Haemostasis,Wiley Online Library,12,2014,Kiana.Martinez,2,Yes,rs687289,rs8176749,,rs507666,rs8176704,4,Yes,No,No,,Yes,1104,"black, white",552,0,0,552,0,0,stroke risk,case-cohort study; association study,probes from TaqMan,No,No,No,No,Yes,No,
53,"Kløve‐Mogensen, Kirstine; Steffensen, Rudi; Masmas, Tania Nicole; Glenthøj, Andreas; Haunstrup, Thure Mors; Ratcliffe, Paul; Höglund, Petter; Hasle, Henrik; Nielsen, Kaspar René; ","ABO, secretor, and Lewis carbohydrate histo‐blood groups are associated with autoimmune neutropenia of early childhood in Danish patients",,,,,,,,,,Transfusion,Wiley Online Library,,2022,Kiana.Martinez,2,Yes,rs8176719,unclear,,,,3,No,Yes,No,,Yes,unclear,Caucasians,0,0,0,unclear,0,0,autoimmune neutropenia of early childhood,case-control study; association study,TaqMan SNP Genotyping Assays,Unclear,No,No,No,No,,"Unclear how the SNPs were used to determine ABO blood typse (rs8176719, rs7853989, rs8176743); Other papers have used rs7853989, rs8176743 for B"
325,"Raffield, Laura M; Lu, Ake T; Szeto, Mindy D; Little, Amarise; Grinde, Kelsey E; Shaw, Jessica; Auer, Paul L; Cushman, Mary; Horvath, Steve; Irvin, Marguerite R; ",Coagulation factor VIII: Relationship to cardiovascular disease risk and whole genome sequence and epigenome‐wide analysis in African Americans,,,,,,,,,1335-1347,Journal of Thrombosis and Haemostasis,Wiley Online Library,18,2020,Kiana.Martinez,2,Yes,rs8176719,,,,rs56392308,2,Yes,No,No,,Yes,3493,African American,3493,0,0,0,0,0,coagulation factor VIII,prospective community-based study; association study,whole genome sequencing,No,No,No,Yes,No,Unclear,
730,"Abdi, A. A.,Osman, A.",Prevalence of common hereditary risk factors for thrombophilia in Somalia and identification of a novel Gln544Arg mutation in coagulation factor V,,,,4.0,4,Journal of Thrombosis and Thrombolysis,English,Embase Medline,536-543,,,44,2017,Kiana.Martinez,2,Yes,rs8176719,,,,,1,No,No,No,,No,101,Somalian,101,0,0,0,0,0,venous thromboembolism,qualitative study,pyrosequencing,No,No,No,No,No,,Describing known SNPs in a Somalian population; no statistics
734,"Ahluwalia, T. S.,Eliasen, A. U.,Sevelsted, A.,Pedersen, C. T.,Stokholm, J.,Chawes, B.,Bork-Jensen, J.,Grarup, N.,Pedersen, O.,Hansen, T.,Linneberg, A.,Sharma, A.,Weiss, S. T.,Evans, M. D.,Jackson, D. J.,Morin, A.,Krogfelt, K. A.,Schjørring, S.,Mortensen, P. B.,Hougaard, D. M.,Bybjerg-Grauholm, J.,Bækvad-Hansen, M.,Mors, O.,Nordentoft, M.,Børglum, A. D.,Werge, T.,Agerbo, E.,Gern, J. E.,Lemanske, R. F., Jr.,Ober, C.,Pedersen, A. G.,Bisgaard, H.,Bønnelykke, K.",FUT2-ABO epistasis increases the risk of early childhood asthma and Streptococcus pneumoniae respiratory illnesses,33328473,Nlm,16-Dec,8.0,1,Nat Commun,eng,PubMed,6398,,,11,2020,Kiana.Martinez,2,Yes,rs505922,,,,,1,Unclear,No,Yes,r2=0.96_rs8176719_rs505922,No,69199,Danish,0,0,0,69199,0,0,asthma,case-control study; GWAS,"Illumina HumanOmniExpressExome 8 v1-2 BeadChip, Illumina HumanExome BeadChip 12.v.1.0,  Illumina Infinium OmniExpress-24 BeadChips",No,No,No,No,No,,
737,"Alkebsi, L.,Ohnishi, H.,Nakajima-Shimada, J.,Onizuka, Y.,Ideno, Y.,Sato, Y.,Hayashi, K.",Validation of the Accuracy of Self-Reported ABO Blood Types in the Japan Nurses’ Health Study,30909687,Nlm,26-Mar,11.0,3,Asian Pac J Cancer Prev,eng,PubMed,789-793,,,20,2019,Kiana.Martinez,2,Yes,rs505922,"rs8176746, rs8176747",,,,3,No,Yes,No,,Yes,41,Japanese,0,0,41,0,0,0,ABO blood groups,qualitative study,direct nucleotide sequencing of PCR,"Yes (rs8176747, rs8176746)",No,No,No,No,No,"Validating ABO blood types between self-reported, genotyping, and serotyping"
750,"Antwi, S. O.,Bamlet, W. R.,Pedersen, K. S.,Chaffee, K. G.,Risch, H. A.,Shivappa, N.,Steck, S. E.,Anderson, K. E.,Bracci, P. M.,Polesel, J.,Serraino, D.,La Vecchia, C.,Bosetti, C.,Li, D.,Oberg, A. L.,Arslan, A. A.,Albanes, D.,Duell, E. J.,Huybrechts, I.,Amundadottir, L. T.,Hoover, R.,Mannisto, S.,Chanock, S. J.,Zheng, W.,Shu, X. O.,Stepien, M.,Canzian, F.,Bueno-de-Mesquita, B.,Quirós, J. R.,Zeleniuch-Jacquotte, A.,Bruinsma, F.,Milne, R. L.,Giles, G. G.,Hébert, J. R.,Stolzenberg-Solomon, R. Z.,Petersen, G. M.",Pancreatic cancer risk is modulated by inflammatory potential of diet and ABO genotype: a consortia-based evaluation and replication study,29800239,Nlm,30-Jul,24.0,8,Carcinogenesis,eng,PubMed,1056-1067,,,39,2018,Kiana.Martinez,2,Yes,rs505922,rs8176746,,,,2,No,Unclear,No,,Yes,6978,"White/Anglo-European, Asian, other",unclear,unclear,unclear,unclear,unclear,unclear,pancreatic cancer,case-control study; consortia-based evaluation and replication study, PanScan I or PanScan II GWAS,No,No,No,Yes,Yes,,"Multiple cohorts from multiple studies used and so it was unclear what the genotyping platform was for all of them; PanScan n = 5483 (""Assessmnent of ABO bloodtype"" paragraph & ""Exclusions"" paragraph) and genotyped for PanC4 n = 1495 from supp table 4"
783,"Barbalic, M.,Dupuis, J.,Dehghan, A.,Bis, J. C.,Hoogeveen, R. C.,Schnabel, R. B.,Nambi, V.,Bretler, M.,Smith, N. L.,Peters, A.,Lu, C.,Tracy, R. P.,Aleksic, N.,Heeriga, J.,Keaney Jr, J. F.,Rice, K.,Lip, G. Y.,Vasan, R. S.,Glazer, N. L.,Larson, M. G.,Uitterlinden, A. G.,Yamamoto, J.,Durda, P.,Haritunians, T.,Psaty, B. M.,Boerwinkle, E.,Hofman, A.,Koenig, W.,Jenny, N. S.,Witteman, J. C.,Ballantyne, C.,Benjamin, E. J.",Large-scale genomic studies reveal central role of ABO in sP-selectin and sICAM-1 levels,,,,57.0,9,Human Molecular Genetics,English,Embase Medline,1863-1872,,,19,2010,Kiana.Martinez,2,Yes,rs8176704,rs8176749,,rs8176704,,3,Yes,No,No,,Yes,unclear,"white, Caucasian, European",unclear,unclear,unclear,unclear,unclear,unclear,sP-selectin and sICAM-1 levels,GWAS,"Affymetrix 6.0 array,  Affymetrix 500k mapping array",No,No,No,No,No,,Multiple cohorts from multiple studies; unclear how many were genotyped even when look at supplementary info. Also that data in the supp doesn't add up and match. And unclear how many of the individuals overlapped between the two phenotypes: sP-selectin and sICAM
800,"Bider-Canfield, Z.,Cotterchio, M.",Self-reported ABO blood type compared with DNA-derived blood group,25265143,Ovid Technologies,Nov,74.0,6,Epidemiology,English,MEDLINE,936-7,,,25,2014,Kiana.Martinez,2,Yes,rs8176719,rs8176746,,,,2,Unclear,Yes,No,,Yes,337,"from Ontario, Canada",unclear,unclear,unclear,unclear,unclear,unclear,ABO bloodtypes,qualitative study,iPLEX assay,No,No,No,No,Unclear,,Comparing self-reported ABO vs DNA-derived blood grouping
804,"Blondon, M.,Wiggins, K. L.,Harrington, L. B.,Psaty, B. M.,Smith, N. L.",Lack of strong effect modification by NFE2L2/CYP3A5/ABO of the risk of venous thrombosis associated with oral hormone therapy,,,,78.0,8,Journal of Thrombosis and Haemostasis,English,Embase Medline,1617-1619,,,11,2013,Kiana.Martinez,2,Yes,rs514659,,,,,1,Unclear,No,Yes,r2=0.72_rs8176719_ rs514659,Yes,2015,European,0,0,0,2015,0,0,venous thrombosis,case-control study; association study,Illumina HumanOmniExpress-12v1_H,No,No,No,No,No,,
816,"Braae, A.,Medway, C.,Carrasquillo, M.,Younkin, S.,Kehoe, P. G.,Morgan, K.,Craig, D.,Johnston, J.,McGuinness, B.,Todd, S.,Heun, R.,Kölsch, H.,Vardy, E. R. L. C.,Hooper, N. M.,Mann, D. M.,Pickering-Brown, S.,Barber, I.,Lowe, J.,Smith, A. D.,Wilcock, G.,Warden, D.,Holmes, C.,Alzheimer's Research, U. K. Consortium",Blood type gene locus has no influence on ACE association with Alzheimer's disease,,,,90.0,4,Neurobiology of Aging,,Scopus,1767.e1-1767.e2,,,36,2015,Kiana.Martinez,2,Yes,rs505922,rs8176746,,,rs8176704,3,Yes,No,No,,No,3396,Alzheimer's Research UK and the Mayo Clinic,unclear,0,0,3396,0,0,Alzheimer’s disease,case-control study; association study,Illumina HumanHap300v1,No,No,No,No,No,,"rs8176704 described as being used to distinguish between A1 and A2, and cites a paper, but unlcear if whether the alternative allele distinguishes A1 or A2"
821,"Brüggemann, A.,Eriksson, N.,Michaëlsson, K.,Hailer, N. P.","Risk of Revision After Arthroplasty Associated with Specific Gene Loci: A Genomewide Association Study of Single-Nucleotide Polymorphisms in 1,130 Twins Treated with Arthroplasty",,,,95.0,7,Journal of Bone and Joint Surgery,English,Embase Medline,610-620,,,104,2022,Kiana.Martinez,2,Yes,,rs7853989,,,,1,Yes,No,No,,Yes,1130,Swedish,0,0,0,1130,0,0,risk of revision surgery following total joint arthroplasty,GWAS,"Illumina OmniExpress panel, Illumina PsychArray panel",No,No,No,No,No,,
823,"Bruzelius, M.,Bottai, M.,Sabater-Lleal, M.,Strawbridge, R. J.,Bergendal, A.,Silveira, A.,Sundström, A.,Kieler, H.,Hamsten, A.,Odeberg, J.",Predicting venous thrombosis in women using a combination of genetic markers and clinical risk factors,,,,97.0,2,Journal of Thrombosis and Haemostasis,English,Embase Medline,219-227,,,13,2015,Kiana.Martinez,2,Yes,rs514659,,,,,1,No,No,Yes,r2=0.90_rs8176719_rs514659,Yes,2835,Swedish,0,0,0,2835,0,0,venous thromboembolism,qualitative study,genotyped using the Illumina GoldenGate platform,No,No,No,Yes,No,,
824,"Bruzelius, M.,Strawbridge, R. J.,Trégouët, D. A.,Wiggins, K. L.,Gertow, K.,Sabater-Lleal, M.,Öhrvik, J.,Bergendal, A.,Silveira, A.,Sundström, A.,Kieler, H.,Syvänen, A. C.,Smith, N. L.,Morange, P. E.,Odeberg, J.,Hamsten, A.",Influence of coronary artery disease-associated genetic variants on risk of venous thromboembolism,24745723,Nlm,Aug,98.0,2,Thromb Res,eng,PubMed,426-32,,,134,2014,Kiana.Martinez,2,Yes,rs514659,rs8176749,,,rs8176704,4,Yes,No,No,,Yes,2821,Swedish,0,0,0,2821,0,0,"coronary heart disease,  venous thromboembolism",case-control study; association study,Illumina Goldengate platform,No,Yes (rs512770),No,Yes,No,,
828,"Bugert, P.,Rink, G.,Kemp, K.,Klter, H.",Blood group ABO genotyping in paternity testing,,,,102.0,3,Transfusion Medicine and Hemotherapy,English,Embase,182-186,,,39,2012,Kiana.Martinez,2,Yes,rs8176719,rs8176747,,,rs56392308,4,Yes,Yes,No,,Yes,1335,German,0,0,0,1335,0,0,ABO bloodtypes,qualitative study,PCR with sequence specific primers,No,No,Yes; O3 (802G>A),No,No,No,Blood group ABO genotyping in paternity testing
839,"Campos, M.,Sun, W.,Yu, F.,Barbalic, M.,Tang, W.,Chambless, L. E.,Wu, K. K.,Ballantyne, C.,Folsom, A. R.,Boerwinkle, E.,Dong, J. F.",Genetic determinants of plasma von Willebrand factor antigen levels: a target gene SNP and haplotype analysis of ARIC cohort,21343614,Nlm,12-May,113.0,19,Blood,eng,PubMed,5224-30,,,117,2011,Kiana.Martinez,2,Yes,rs514659,rs8176749,,,rs8176704,4,Yes,No,No,,Yes,15792,European,0,0,0,15792,0,0,von Willebrand factor antigen levels,prospective cohort study; correlation study,"Affymetrix, Version 6.0 platform",No,Yes (rs512770),No,No,No,,Using data from ARIC an ongoing prospective cohort study
866,"Chen, Y.,Hu, N.,Liao, L.,Yu, K.,Shu, X. O.,Zheng, W.,Yuan, J. M.,Koh, W. P.,Qiao, Y. L.,Fan, J. H.,Dawsey, S. M.,Freedman, N. D.,Taylor, P. R.,Goldstein, A. M.,Abnet, C. C.",ABO genotypes and the risk of esophageal and gastric cancers,34022824,Nlm,22-May,140.0,1,BMC Cancer,eng,PubMed,589,,,21,2021,Kiana.Martinez,2,Yes,rs505922,rs8176746,,,,3,Yes,No,No,,Yes,7068,Chinese ethnicity,0,0,7068,0,0,0,esophageal and gastric cancers,case-control study; association study,Illumina 660 W array,No,No,No,Yes,No,,Cited using anoter SNP (rs574347) but unclear how this was used
927,"Davenport, E. R.,Goodrich, J. K.,Bell, J. T.,Spector, T. D.,Ley, R. E.,Clark, A. G.","ABO antigen and secretor statuses are not associated with gut microbiota composition in 1,500 twins",,,,201.0,1,BMC Genomics,English,Embase Medline,,,,17,2016,Kiana.Martinez,2,Yes,rs687289,rs8176746,,rs651007,rs8176704,4,Yes,Yes,Yes,r2=rs507666_rs651007_ 0.955,Yes,1503,"United Kingdom adult Twin Health Registry, caucasian",0,0,0,1503,0,0,gut microbiota composition,cohort study; association study,"Illumina HumanHap300 Bead Chip, Illumina HumanHap610 Quad Chip",No,No,No,No,No,,Using data from the United Kingdom adult Twin Health Registy
1071,"Goumidi, L.,Thibord, F.,Wiggins, K. L.,Li-Gao, R.,Brown, M. R.,van Hylckama Vlieg, A.,Souto, J. C.,Soria, J. M.,Ibrahim-Kosta, M.,Saut, N.,Daian, D.,Olaso, R.,Amouyel, P.,Debette, S.,Boland, A.,Bailly, P.,Morrison, A. C.,Mook-Kanamori, D. O.,Deleuze, J. F.,Johnson, A.,de Vries, P. S.,Sabater-Lleal, M.,Chiaroni, J.,Smith, N. L.,Rosendaal, F. R.,Chasman, D. I.,Trégouët, D. A.,Morange, P. E.",Association between ABO haplotypes and the risk of venous thrombosis: impact on disease risk estimation,33512453,Nlm,29-Apr,345.0,17,Blood,eng,PubMed,2394-2402,,,137,2021,Kiana.Martinez,2,Yes,rs8176719,rs8176743,,rs2519093,rs1053878,5,Yes,Unclear,No,,Yes,13870,unclear,unclear,unclear,unclear,unclear,unclear,unclear,risk of venous thrombosis,cohort stuyd; association study; fine-mapping study,previously typed for genome-wide genotyped data,No,Yes (rs41302905),No,Yes,Unclear,,"Data from 6 case-control/prospective studies of VT risk: Cardiovascular Health Study, Early Onset of Venous Thrombosis Study, the Hearth and Vascular Health, the marseille Thrombosis Association study, the Multiple Environmental and Genetic Assessment of risk factors for venous thrombosis study, studies that were described by Germain et al, and the RETROVE study"
1127,"Hickson, N.,Hampshire, D.,Winship, P.,Goudemand, J.,Schneppenheim, R.,Budde, U.,Castaman, G.,Rodeghiero, F.,Federici, A. B.,James, P.,Peake, I.,Eikenboom, J.,Goodeve, A.",Von Willebrand factor variant p.Arg924Gln marks an allele associated with reduced von Willebrand factor and factor VIII levels,,,,401.0,9,Journal of Thrombosis and Haemostasis,English,Embase Medline,1986-1993,,,8,2010,Kiana.Martinez,2,Yes,rs8176719,rs8176749,,,rs1053878,3,Yes,No,No,,Yes,1263,Caucasian,0,0,0,1263,0,0,von Willebrand factor and factor VIII levels,case-control study; association study,5′nuclease TaqMan allelic discrimination assay,No,Yes (rs1053878),No,Yes,No,,Genomic data from MCMDM-1VWD study 
1191,"Jelinek, H. F.,Mousa, M.,Alkaabi, N.,Alefishat, E.,Daw Elbait, G.,Kannout, H.,AlHumaidan, H.,Selvaraj, F. A.,Imambaccus, H.,Weber, S.,Uddin, M.,Abdulkarim, F.,Mahboub, B.,Tay, G.,Alsafar, H.",Allelic Variants Within the ABO Blood Group Phenotype Confer Protection Against Critical COVID-19 Hospital Presentation,,,,465.0,,Frontiers in Medicine,English,Embase,,,,8,2021,Kiana.Martinez,2,Yes,rs8176719,rs8176747,rs8176746,,,3,Yes,Yes,No,,Yes,646,from the United Arab Emirates,0,0,0,0,646,0,COVID-19,cross-sectional study; association study,Infinium Global Screening Array,No,No,No,No,No,,
1192,"Jiang, E.,Yu, P.,Zhang, S.,Li, C.,Ding, M.,Wang, B.,Pang, H.",Establishment of an alternative efficiently genotyping strategy for human ABO gene,29102834,Nlm,Nov,466.0,,Leg Med (Tokyo),eng,PubMed,72-76,,,29,2017,Kiana.Martinez,2,Yes,rs8176719,rs8176720,,,rs56392308,4,No,No,No,,No,92,from China Medical University,0,0,92,0,0,0,ABO genotyping,methods paper,multiplexed PCR amplicons melting assay,No,Yes (SNP unclear),Yes (c.1009A>G for A205),No,No,No,Establishing a protocal for ABO genotyping
1226,"Keller, J. A.,Horn, T.,Scholz, S.,Koenig, S.,Keller, M. A.",Comparison of ABO genotyping methods: A study of two low-resolution polymerase chain reaction assays in a clinical testing laboratory,,,,500.0,4,Immunohematology,English,Embase,149-153,,,35,2020,Kiana.Martinez,2,Yes,rs8176719,rs8176743,,,rs1053878,4,Unclear,Yes,No,,No,unclear,unclear,unclear,unclear,unclear,unclear,unclear,unclear,ABO genotyping,methodology paper,TaqMan-based SSP-PCR and PCR-RFLP,No,Yes (c.1096G/A),No,No,Unclear,No,Comparing ABO genotyping PCR methods
1310,"Li-Gao, R.,Carlotti, F.,De Mutsert, R.,Van Hylckama Vlieg, A.,De Koning, E. J. P.,Jukema, J. W.,Rosendaal, F. R.,Van Dijk, K. W.,Mook-Kanamori, D. O.",Genome-wide association study on the early-phase insulin response to a liquid mixed meal: Results from the NEO study,,,,584.0,12,Diabetes,English,Embase Medline,2327-2336,,,68,2019,Kiana.Martinez,2,Yes,rs8176645,rs8176749,,,rs56392308,4,Yes,No,Yes,r2=0.98_rs8176719_rs8176645; r2=0.99_rs8176750_rs8176704,Yes,4803,Netherlands,0,0,0,4803,0,0,insulin response,GWAS,llumina HumanCoreExome-24 BeadChip,No,Yes (rs7853989),No,Yes,No,,
1356,"Luo, J. Q.,He, F. Z.,Luo, Z. Y.,Wen, J. G.,Wang, L. Y.,Sun, N. L.,Tang, G. F.,Li, Q.,Guo, D.,Liu, Z. Q.,Zhou, H. H.,Chen, X. P.,Zhang, W.",Rs495828 polymorphism of the ABO gene is a predictor of enalapril-induced cough in Chinese patients with essential hypertension,,,,630.0,6,Pharmacogenetics and Genomics,,Scopus,306-313,,,24,2014,Kiana.Martinez,2,Yes,,rs8176746,,,,2,No,No,No,,Yes,450,Han Chinese,0,0,450,0,0,0,angiotensin-converting enzyme inhibitor (enalapril) induced cough,association study,PCR-direct sequencing,No,Yes (rs8176740),No,No,No,,investigated the association of ABO genetic polymorphisms with the risk of enalapril-induced cough
1614,"Rizzato, C.,Kato, I.,Plummer, M.,Muñoz, N.,Stein, A.,Jan van Doorn, L.,Franceschi, S.,Canzian, F.",Risk of advanced gastric precancerous lesions in Helicobacter pylori infected subjects is influenced by ABO blood group and cagA status,23319424,Nlm,15-Jul,888.0,2,Int J Cancer,eng,PubMed,315-22,,,133,2013,Kiana.Martinez,2,Yes,rs505922,"rs8176746, rs8176747",,,rs1053878,5+,Yes,No,No,,Yes,2077,Venezuelan,0,2077,0,0,0,0,risk of advanced gastric precancerous lesions in Helicobacter pylori infected subjects,association study,allelespecific PCR-based KASPar SNP genotyping system,"Yes (rs8176747, rs8176746)",No,No,No,No,,
1656,"Sato, A.,Usui, H.,Shozu, M.",ABO blood type compatibility is not a risk factor for gestational trophoblastic neoplasia development from androgenetic complete hydatidiform moles,32191360,Nlm,Jun,930.0,6,Am J Reprod Immunol,eng,PubMed,e13237,,,83,2020,Kiana.Martinez,2,Yes,rs8176719,rs8176749,,,,2,No,Yes,No,,Yes,129,Japanese,0,0,129,0,0,0,prognosis of androgenetic gestational trophoblastic neoplasia,qualitative study,real-time polymerase chain reaction (PCR) and high-resolution melting (HRM) assay,No,No,No,No,No,No,"Used a lot of seemingly useless SNPs when looking at table provided by publication; 7 total SNPs used: rs505922, rs1053878, rs8176720, rs8176741, rs8176746, rs8176747; unclear how to describe this study: the incidence of GTN was compared based on ABO compatibility between the patients and their molar tissues - anovas and fishers exact tests"
1680,"Severe Covid, Gwas Group,Ellinghaus, D.,Degenhardt, F.,Bujanda, L.,Buti, M.,Albillos, A.,Invernizzi, P.,Fernandez, J.,Prati, D.,Baselli, G.,Asselta, R.,Grimsrud, M. M.,Milani, C.,Aziz, F.,Kassens, J.,May, S.,Wendorff, M.,Wienbrandt, L.,Uellendahl-Werth, F.,Zheng, T.,Yi, X.,de Pablo, R.,Chercoles, A. G.,Palom, A.,Garcia-Fernandez, A. E.,Rodriguez-Frias, F.,Zanella, A.,Bandera, A.,Protti, A.,Aghemo, A.,Lleo, A.,Biondi, A.,Caballero-Garralda, A.,Gori, A.,Tanck, A.,Carreras Nolla, A.,Latiano, A.,Fracanzani, A. L.,Peschuck, A.,Julia, A.,Pesenti, A.,Voza, A.,Jimenez, D.,Mateos, B.,Nafria Jimenez, B.,Quereda, C.,Paccapelo, C.,Gassner, C.,Angelini, C.,Cea, C.,Solier, A.,Pestana, D.,Muniz-Diaz, E.,Sandoval, E.,Paraboschi, E. M.,Navas, E.,Garcia Sanchez, F.,Ceriotti, F.,Martinelli-Boneschi, F.,Peyvandi, F.,Blasi, F.,Tellez, L.,Blanco-Grau, A.,Hemmrich-Stanisak, G.,Grasselli, G.,Costantino, G.,Cardamone, G.,Foti, G.,Aneli, S.,Kurihara, H.,ElAbd, H.,My, I.,Galvan-Femenia, I.,Martin, J.,Erdmann, J.,Ferrusquia-Acosta, J.,Garcia-Etxebarria, K.,Izquierdo-Sanchez, L.,Bettini, L. R.,Sumoy, L.,Terranova, L.,Moreira, L.,Santoro, L.,Scudeller, L.,Mesonero, F.,Roade, L.,Ruhlemann, M. C.,Schaefer, M.,Carrabba, M.,Riveiro-Barciela, M.,Figuera Basso, M. E.,Valsecchi, M. G.,Hernandez-Tejero, M.,Acosta-Herrera, M.,D'Angio, M.,Baldini, M.,Cazzaniga, M.,Schulzky, M.,Cecconi, M.,Wittig, M.,Ciccarelli, M.,Rodriguez-Gandia, M.,Bocciolone, M.,Miozzo, M.,Montano, N.,Braun, N.,Sacchi, N.,Martinez, N.,Ozer, O.,Palmieri, O.,Faverio, P.,Preatoni, P.,Bonfanti, P.,Omodei, P.,Tentorio, P.,Castro, P.,Rodrigues, P. M.,Blandino Ortiz, A.,de Cid, R.,Ferrer, R.,Gualtierotti, R.,Nieto, R.,Goerg, S.,Badalamenti, S.,Marsal, S.,Matullo, G.,Pelusi, S.,Juzenas, S.,Aliberti, S.,Monzani, V.,Moreno, V.,Wesse, T.,Lenz, T. L.,Pumarola, T.,Rimoldi, V.,Bosari, S.,Albrecht, W.,Peter, W.,Romero-Gomez, M.,D'Amato, M.,Duga, S.,Banales, J. M.,Hov, J. R.,Folseraas, T.,Valenti, L.,Franke, A.,Karlsen, T. H.",Genomewide Association Study of Severe Covid-19 with Respiratory Failure,32558485,Ovid Technologies,10 15,954.0,16,New England Journal of Medicine,English,MEDLINE,1522-1534,,,383,2020,Kiana.Martinez,2,Yes,rs8176719,rs8176747,,,,3,Yes,No,No,,Yes,4361,Spanish & Italian,0,0,0,4361,0,0,COVID-19,GWAS,Illumina Global Screening Array v 2.0,No,Yes (rs41302905),No,Yes,No,,
1753,"Taira, C.,Matsuda, K.,Takeichi, N.,Furukawa, S.,Sugano, M.,Uehara, T.,Okumura, N.,Honda, T.",Rapid ABO genotyping by high-speed droplet allele-specific PCR using crude samples,28295603,Nlm,Jan,1027.0,1,J Clin Lab Anal,eng,PubMed,,,,32,2018,Kiana.Martinez,2,Yes,rs8176719,"rs8176747, rs7853989",,,,3,No,No,No,,No,29,study done in China,0,0,29,0,0,0,ABO genotyping,methodology study,droplet allelespecific PCR,No,No,No,No,No,,
1768,"Tao, B.,Yang, M.,Chen, H.,Pan, H.,Liu, W.,Yi, H.,Tang, S.",Association of ABO blood group and antituberculosis drug-induced liver injury: A case-control study from a Chinese Han population,32259340,Nlm,Aug,1042.0,4,J Clin Pharm Ther,eng,PubMed,638-645,,,45,2020,Kiana.Martinez,2,Yes,rs8176719,rs8176746,,,,2,Unclear,No,No,,Yes,unclear,Chinese Han,unclear,unclear,unclear,unclear,unclear,unclear,antituberculosis drug-induced liver injury,case-control study,TaqMan genotyping assays,No,No,No,Yes,No,,
1777,"Terao, C.,Bayoumi, N.,McKenzie, C. A.,Zelenika, D.,Muro, S.,Mishima, M.,Connell, J. M. C.,Vickers, M. A.,Mark Lathrop, G.,Farrall, M.,Matsuda, F.,Keavney, B. D.",Quantitative variation in plasma angiotensin-i converting enzyme activity shows allelic heterogeneity in the ABO blood group locus,,,,1051.0,6,Annals of Human Genetics,English,Embase Medline,465-471,,,77,2013,Kiana.Martinez,2,Yes,unclear,unclear,unclear,unclear,unclear,3,Yes,No,No,,Yes,1425,Northern and Western European ancestry,0,0,0,1425,0,0,angiotensin-I converting enzyme (ACE),GWAS,multiplex polymerase chain reaction,No,Yes (SNP unclear),No,No,No,,"3 SNPs said to be used (rs505922, rs8176746, rs8176750) but the table produced in the publication makes it unclear how the SNPs were used to type A1, A2, B, and O"
1785,"Thorne, Lucy,Nalwoga, Angela,Mentzer, Alexander J.,Rougemont, Alexis De,Hosmillo, Myra,Webb, Emily,Nampiija, Margaret,Muhwezi, Allan,Carstensen, Tommy,Gurdasani, Deepti,Thorne, L.,Nalwoga, A.,Mentzer, A. J.,de Rougemont, A.,Hosmillo, M.,Webb, E.,Nampiija, M.,Muhwezi, A.,Carstensen, T.,Gurdasani, D.",The First Norovirus Longitudinal Seroepidemiological Study From Sub-Saharan Africa Reveals High Seroprevalence of Diverse Genotypes Associated With Host Susceptibility Factors,130914831. Language: English. Entry Date: 20190913. Revision Date: 20220131. Publication Type: journal article,EBSCOhost,,1059.0,5,Journal of Infectious Diseases,,rzh,716-725,,,218,2018,Kiana.Martinez,2,Yes,rs8176719,rs8176747,,,,2,Yes,No,No,,Yes,651,African,651,0,0,0,0,0,Human noroviruses,association study,Illumina Omni2.5M array,No,No,No,No,No,,
1797,"Trégouët, D. A.,Heath, S.,Saut, N.,Biron-Andreani, C.,Schved, J. F.,Pernod, G.,Galan, P.,Drouet, L.,Zelenika, D.,Juhan-Vague, I.,Alessi, M. C.,Tiret, L.,Lathrop, M.,Emmerich, J.,Morange, P. E.",Common susceptibility alleles are unlikely to contribute as strongly as the FV and ABO loci to VTE risk: results from a GWAS approach,19278955,Nlm,21-May,1071.0,21,Blood,eng,PubMed,5298-303,,,113,2009,Kiana.Martinez,2,Yes,rs8176719,rs8176746,,,rs8176750,3,Unclear,No,No,,Yes,1717,Northern European origin; French whites,0,0,0,1717,0,0,venous thromboembolism,GWAS,Illumina Sentrix HumanHap300 Beadchip,No,No,No,Yes,No,,"Bloodtyped with SNPs only for MARTHA study, n's in supplemental table 2; unclear if these SNPs from MARTHA were phased"
